ID,author,post,score,created_utc,edited,is_submitter,post,parent_id_old\,comments,original_commentjff8oc0,u/anonymasss,"true for me - upgraded my 980ti to a used 2080.

this is just on the brink of bottlenecking my i5 4460 but ill do a whole upgrade in a couple of years time",2,4/8/2023 4:28,FALSE,FALSE,price of GPU are insane,t1_j3evevu,,j3c7f3i,u/truupR,"AMD decided to go the Nvidia pricing route. So now you've got lackluster AMD cards for å£1200+ thats propping up and justifying Nvidias laughable prices.

If AMD said fuck it, 7900XTX for å£800, Nvidia would almost have no choice but to drop the price of their 40 series cards. But no, they're both greedy cunts and think they can still cash in.",23,1/7/2023 9:56,FALSE,FALSE,price of GPU are insane,t1_j3br8qx,,j3c19oc,u/fashric,AMD should dominate the mid range with the 6000 series but people are dumb and only look at Nvidia and end up paying more for less,10,1/7/2023 9:07,FALSE,FALSE,price of GPU are insane,t1_j3br8qx,,j3cm7i7,u/Nesqu,"A ps5 is \~550 dollars.

It has an utterly zooming SSD, runs most games upscaled 4k at 60fps.

That price includes a peripherals you'll ever need in the form of 1 controller.",22,1/7/2023 11:42,FALSE,FALSE,price of GPU are insane,t1_j3c05j2,,j3cp5yq,u/RedKomrad,"It depends on what you‰Ûªre using your computer for and want you want it to do. 

When I had a 24‰Û 4k display, my 1660 ti was fine, right I had to turn down settings on some games, especially modded Skyrim as your can really load the GPU with various graphics mods.

When I upgraded to a 49‰Û display and wanted all the pretty graphics mods at 5120x1440 resolution and 60 fps, even a 3080 10Gb wasn‰Ûªt enough! 

So your requirements very relative to what you want to do with your PC. I use apps that are designed around CUDA cores, so AMD is out, for example. 

Now , if I go back to 1080p gaming and don‰Ûªt install graphic mods, I could probably put the 1660 ti card back in and be fine.",5,1/7/2023 12:02,FALSE,FALSE,price of GPU are insane,t1_j3c05j2,,j3cgqpv,u/SpecificAstronaut69,(Deck not available in the majority of the world.),12,1/7/2023 11:05,FALSE,FALSE,price of GPU are insane,t1_j3c2ttt,,j3c8iav,u/Anoscetia,"How is emulation of MAME and other consoles on the deck these days? I have dozens of GB's of roms lying around, might as well take the step if it comes to it.",1,1/7/2023 10:05,FALSE,FALSE,price of GPU are insane,t1_j3c2ttt,,j3g1e3n,u/knukeh,Depends what you do for work i suppose.  Some people will be needed amd paid well.,1,1/8/2023 3:08,FALSE,FALSE,price of GPU are insane,t1_j3csya1,,j3dth93,u/JonWood007,No but if current prices are the new normal we might be in trouble long term.,2,1/7/2023 16:25,FALSE,FALSE,price of GPU are insane,t1_j3c9r1e,,j3g0l7e,u/knukeh,Wife just got me a series x for xmas.  Its shit compared to pc.  And I use it on a 65in lg oled c2.,0,1/8/2023 2:58,FALSE,FALSE,price of GPU are insane,t1_j3drywf,,j3j5rfy,u/TenshiBR,"You can always enter in a GPU diet, I heard the 4080 is gluten free",1,1/8/2023 17:59,FALSE,FALSE,price of GPU are insane,t1_j3e8yah,,j3g2a75,u/Rankerhowl99,That 4080 has 48 tflops. The ps5 has 10 tflops. It's has almost 5 times more graphics power. Your comparing a basic entry level console to a luxury video card that can output consistent 120fps for high refresh rate monitors.,2,1/8/2023 3:19,FALSE,FALSE,price of GPU are insane,t1_j3f73c8,,j3c1ran,u/TheNevers,"May be you'll, but you're probably wrong, plennty of 4080 around means people aren't buying that shit pricing.",8,1/7/2023 9:11,FALSE,FALSE,price of GPU are insane,t1_j3bp7jv,,j3csmyd,u/RedKomrad,"Using my local Micro Center as a reference, so YMMV, 4080‰Ûªs have been in stock more often than 4090‰Ûªs, but the are fiber by the end to of the day. 

Interestingly, 4070 ti‰Ûªs have been in stock since launch. So, at least in my local area, people are snatching up 4080s & 4090s , but leaving 4070 ti‰Ûªs on the shelf.",1,1/7/2023 12:24,FALSE,FALSE,price of GPU are insane,t1_j3bp7jv,,j3ckgsh,u/RanaI_Ape,"There is real competition in the CPU market. The GPU market is completely dominated by one brand.

Remember before Ryzen when Intel was your only real choice for CPU? 4 core CPUs with ~5% performance bump each gen, for 6 straight years. What was an i7 in 2017 became the i3 in 2019 because of Ryzen's pressure. We need a shakeup in the GPU market like we had with CPUs.",8,1/7/2023 11:31,1/7/2023 11:34,FALSE,price of GPU are insane,t1_j3c2n78,,j3cvjtc,[deleted],[deleted],1,1/7/2023 12:43,FALSE,FALSE,price of GPU are insane,t1_j3c2n78,,j3crnju,u/DoubleWolf,">consumers who desperately bought GPUs at grossly inflated prices during the pandemic

>And the market showed it was willing to pay 50% higher prices than in the past.

Let's not forget that many people were flush with extra cash during that time from the government stimuli, making paying extra for a new GPU, when faced with the prospect of staying inside for the foreseeable future, seem like a good deal. Nvidia clearly didn't consider that the outdoors still exist when pricing the latest generation.",1,1/7/2023 12:18,FALSE,FALSE,price of GPU are insane,t1_j3c9rry,,j6q7y1i,u/Specific_Event5325,"Turing is coming down in price.  I just searched Ebay and 2080 Ti's can be had in the 200-400 dollar range.  2070 Super 150-250.  Ampere is still overpriced at say 70 Ti and up.  At that point you are going to pay around 700 dollars for a 3080 Ti, maybe a miner GPU?  Who knows.  

I agree that you don't need the latest and greatest, but prices are out of control.  I would cede that the 2080 Ti launched back in 2019 for a ridiculous price of, 1300 US dollars I think?  But a 2070 Super, when new, was only 499 and now this 4070 Ti is at least 800 dollars or more.  Just because it does more doesn't make it good value in my opinion.  A perfect storm of shit destroyed the market for normal folks, and will it ever normalize and lower?  I can't say.  But if people keep buying at overpriced levels, it will never go down.",1,1/31/2023 21:51,FALSE,FALSE,price of GPU are insane,t1_j3c9rry,,j3ca47t,u/derkrieger,"I mean the driver thing is at least somewhat justified as AMDs drivers for awhile were a dumpster fire, sometimes causing more issues than they fixed. Nvidia you could generally be confident after the new driver had been out for a few days if people didnt catch any problems where as AMD had patches of ""DO NOT UPDATE"" since it just hurt performance.",0,1/7/2023 10:17,FALSE,FALSE,price of GPU are insane,t1_j3c20g5,,j3cvexp,u/RedKomrad,"Not just the drivers, but also the hardware. If you do any work with machine learning, the CUDA cores are very useful.",1,1/7/2023 12:42,FALSE,FALSE,price of GPU are insane,t1_j3c20g5,,j3defs0,[deleted],I literally just found an RTX 3050 right now for $250 with no effort. It was the first result in Google.,1,1/7/2023 14:46,FALSE,FALSE,price of GPU are insane,t1_j3c20g5,,j3c9vl3,u/derkrieger,"yuuup, not really having any issues either. Not running at a crazy resolution or anything but looks fine, plays fine.",2,1/7/2023 10:15,FALSE,FALSE,price of GPU are insane,t1_j3c48s2,,j3dvbl1,u/dudebirdyy,Buying shit to get that rush of excitement and dopamine is unironically a major cope for a lot of people.,3,1/7/2023 16:37,FALSE,FALSE,price of GPU are insane,t1_j3cl5wx,,j3dh6w5,u/BayesBestFriend,"literally no one but ""grown ass adults"" can afford what are top of the line tech meant for enthusiasts. 

To anyone who doesnt play games, spending more than $300 on a windows machine is batshit crazy.",4,1/7/2023 15:04,FALSE,FALSE,price of GPU are insane,t1_j3cl5wx,,j3g1aq2,u/knukeh,"A ton of grown ass adults actually have good careers that pay well cause they decided serving coffee and working retail is shit.  I bought a 21 f150 a 21 escape for thr wife, a 21 camper last year not for status.  But because I could.  I spent over 4k on xmas for my kids and wife.  Got myself a new oled monitor and 13700k.  Have a 3080 but will wait for the 5080 to upgrade my gpu.  Just because ppl buy nice things doesnt mean its a status thing.  Its cause they decided to make something of themselves and have the financial means.",1,1/8/2023 3:06,FALSE,FALSE,price of GPU are insane,t1_j3cl5wx,,j3ceqbi,u/Odyssey1337,The 30-series prices are still inflated 2 years after launch.,21,1/7/2023 10:51,FALSE,FALSE,price of GPU are insane,t1_j3cb84y,,j3cumph,u/halcyoncinders,"Unfortunately, this is exactly what Nvidia wants people to do and is a huge factor in their current pricing strategy. If someone is going to go this route, I would highly recommend buying used instead of helping Nvidia clear their excess inventory.",6,1/7/2023 12:37,FALSE,FALSE,price of GPU are insane,t1_j3cb84y,,j3dtsrg,u/JonWood007,"Better idea, buy amd. Their 6000 series is an insane value relatively speaking.",2,1/7/2023 16:27,FALSE,FALSE,price of GPU are insane,t1_j3cb84y,,j3exkov,u/yttanx,"This sounds super adorbs and all, but you're still putting money in nvidia bank account. They want you to buy all the cards don't matter what number is on the label.",1,1/7/2023 21:06,FALSE,FALSE,price of GPU are insane,t1_j3cb84y,,j3dtkzm,u/JonWood007,"1060 is still capable on low settings, especially with fsr on.",1,1/7/2023 16:26,FALSE,FALSE,price of GPU are insane,t1_j3cezms,,j3c3xmf,u/colts1878,I can‰Ûªt see that since they‰Ûªre targeting a different consumer.,9,1/7/2023 9:29,FALSE,FALSE,price of GPU are insane,t1_j3br1he,,j7qjx1g,u/flatlandskid94,the [slient] norm. I'm surprised so many ppl own a 4090 on here lol.,2,2/8/2023 13:29,FALSE,FALSE,price of GPU are insane,t1_j3cbmqa,,j3dq9k3,u/bahumat42,"Well even if they are all carrying around 1000 dollars phones (they aren't). Phones have a lot more utility than a single piece of gaming hardware.

Maps, phone calls, texting, filming, photograpy, writing, gaming, editing (photo/music), emails, web browsing, shopping,  watching video content, listening to music, smart device control all on a small, portable handhold device with good UI.

By all means criticize people overspending on luxury items, i just don't think phones are as good of a target as you think they are.",3,1/7/2023 16:03,FALSE,FALSE,price of GPU are insane,t1_j3cl7h4,,j3c2nhh,u/green9206,"Your numbers are wrong, rx 480 was $200-250, 1060 3gb was $200-230",3,1/7/2023 9:19,FALSE,FALSE,price of GPU are insane,t1_j3bzefw,,j3dfg0r,u/FallenAdvocate,"You get so much less price/performance in laptops over desktops though. If you need a laptop it's one thing, but you're implying that gaming on a laptop is more price efficient?",2,1/7/2023 14:52,FALSE,FALSE,price of GPU are insane,t1_j3cde27,,jaapb3b,u/Stickic,"Only $200??????
HOW, WHERE?!?!?!?!?!?!
Here in EU its like 380‰âÂ ....
FML",1,2/27/2023 20:50,FALSE,FALSE,price of GPU are insane,t1_j3fgpfz,,j3cj48f,u/H0vis,"A last generation 70 model for six hundred seems low to you?

The 1080s were $600.",9,1/7/2023 11:21,FALSE,FALSE,price of GPU are insane,t1_j3cfsbl,,j3bwn3o,u/Arthur_Morgan44469,What?,3,1/7/2023 8:25,FALSE,FALSE,price of GPU are insane,t1_j3bta9r,,j3bq90r,u/Mm11vV,Learn to read.,10,1/7/2023 7:16,FALSE,FALSE,price of GPU are insane,t1_j3bmx2d,,j3bnz5t,u/Baraka1987,"Dude WTF? Do you feel like a big boy saying shit like that? Just because he isn't a native speaker, you can still understand what he said. Don't be an ass!",17,1/7/2023 6:49,FALSE,FALSE,price of GPU are insane,t1_j3bmx2d,,j3bofd2,u/GameStunts,"Don't be so rude. A user name like PrashanthDoshi doesn't sound like a native speaker, probably Indian/Pakistani/Asian. There was nothing in that post I didn't understand, and you forgot to end your sentence with a period/full stop.",12,1/7/2023 6:54,FALSE,FALSE,price of GPU are insane,t1_j3bmx2d,,j3d34c8,u/nekromantique,"Especially as more and more TVs start becoming not just 4K, but 4k120.

Hell, top end TVs like the LG C-series and Samsung TVs also have gsync/vrr support...making them nice as hell for someone who doesn't want to sit in front of a monitor for every game.

I occasionally hook my 2080 super up to my C1 for RPGs/other single player games, but usually play on a 1440p monitor.  2080 is okay at best for 4k (dlss helps, but the card won't push above 4k60 with HDR on a TV due to the hdmi spec anyway). 

 The new cards are awful value, but I do laugh at those that are like ""my 970 is still usable, I can't see why anyone would want to upgrade"".

Like...thats nice that your 970 is probably doing well enough on a 21"" 1080p60 monitor.  If that works for you, and all you wany....thats awesome.  But don't pretend there isn't a benefit to upgrading (someone actually told me here there is no visual benefit to playing games at 4k let alone high refresh rates).",1,1/7/2023 13:32,FALSE,FALSE,price of GPU are insane,t1_j3cauwa,,j3g1893,u/Rankerhowl99,Nobody has to spend $1000+ on a GPU the same way that nobody has to spend 100k+ on a sports car. If you want the performance you have to pay the money for the best of the best.,1,1/8/2023 3:06,FALSE,FALSE,price of GPU are insane,t1_j3flw6d,,j3jwprj,u/Rivale,"AMD provides the APU for every console, but the switch. The switch is powered by NVIDIA. These consoles are basically sold at a loss because they can then lock you into their marketplace of $70 games and it probably gives Sony some TV sales.",1,1/8/2023 21:00,FALSE,FALSE,price of GPU are insane,t1_j3ipcu9,,jhhrzwg,u/likalaruku,I thought the prices went up because Cryptobros were buying up all the cards to mine bitcoin.,1,4/24/2023 3:35,FALSE,FALSE,price of GPU are insane,t1_j6jp1dz,,ja50070,[deleted],"I'm not even bothering with PC gaming anymore, I still have my 5700xt, but as games get more demanding, it's going obsolete like a free falling safe. My GPU comes up on Steam's recommended section whenever I search a game, that's a sign your PC is old. I have never liked Nvidia as a company, however their destruction of the used GPU market is their fault, they love scalpers putting their product out there and artificially raising prices. 

I still use my PC for older games, no issues emualting whatever I want. I'm currently doing a ton of mods of the Mass Effect trilogy and having fun, but any newer AAA game is either poorly optimized or I need an overpriced GPU to play it in 4k. AMD is always behind the curve on GPUs, how they toppled Intel but can't compete with Nvidia confuses me.",1,2/26/2023 16:58,FALSE,FALSE,price of GPU are insane,t1_ja0zhet,,j3evcgn,u/H0vis,"The thing is that right now we can't know if this is a blip or if Nvidia have decided that it is perfectly fine for a graphics card to cost as much as the rest of the PC.

It's not enough at this point for prices to remain where they are. They need to come down. If they don't, of if they go up even more? That next console generation is going to be greeted with a lot more interest by PC gamers.",26,1/7/2023 20:50,FALSE,FALSE,price of GPU are insane,t1_j3eomoy,,j3i2bor,u/high1186,My 2080ti died after 3 years... I am a PS5 gamer now.,13,1/8/2023 13:57,FALSE,FALSE,price of GPU are insane,t1_j3eomoy,,j3fqr8m,u/bassbeater,"You might consider running Linux.... it's lighter weight, doesn't really run ray tracing (from my impressions from some threads here), and your hardware might run better as it's a pretty fast experience operating in big picture mode. Also, depending if you go PS4/Xbone, you're still stuck with mechanical drives as opposed to SSD. My PC was built in 2015 and aside from the graphics package, which I updated in July, things still work great. 

Personally, even tho Xbox/ Playstation controllers are the most accessible, I'm kind of annoyed how everyone is supposed to be accustomed to expecting joystick drift etc. I've been using Steam Controller as my primary, another reason I don't really want to change anything.",1,1/8/2023 1:06,FALSE,FALSE,price of GPU are insane,t1_j3eomoy,,j3i3eiu,u/GoalAccomplished8955,"> Some people in this sub has said this is all hoopla. 

Its not hoopla but a lot of its overstated and also geography dependent. With your current setup you could plug and play a 3060 and be largely fine for well under the cost of a PS5/XboxX in certain areas. I can get a 3060 for $300 in my area which is cheaper than the primary consoles. The Xbox S is a closer competition and the rest of your comment makes it sound like you'd prefer that form factor so it seems like a good choice over upgrading.",1,1/8/2023 14:04,FALSE,FALSE,price of GPU are insane,t1_j3eomoy,,j3ozorc,u/fatamSC2,"I think it's a little bit of both. Yeah the prices are absolutely too high, but keep in mind to have the ""equivalent"" of a console you can be running a fairly old card, which costs way less. So yes it's going to cost you an arm and a leg to stay ultra current  but you can get something that will run everything reasonably, just like consoles do, for a fraction of the price",1,1/9/2023 20:58,FALSE,FALSE,price of GPU are insane,t1_j3eomoy,,ja551hl,u/AmeliaBuns,I hate controllers so much tho ;-; and really wanna play satisfactory,1,2/26/2023 17:33,FALSE,FALSE,price of GPU are insane,t1_j3eomoy,,j3eydvc,u/VagrantShadow,"The Xbox Series S is such a beast of an emulator unit.  You can play Atari, NES, SNES, Playstation 1, Playstation 2, Gamecube, and a ton of other systems games on that console just by following simple instructions.

Never mind, the fact as you said you have Game Pass.  It is a hell of a deal, add to the fact that you can also stream the games on that system and the server blades that Microsoft uses for their streaming are Series X.",29,1/7/2023 21:12,FALSE,FALSE,price of GPU are insane,t1_j3e3yc7,,j3i20ul,u/GoalAccomplished8955,"Where consoles offer a very obvious benefit is if you are building a PC *from scratch* and you are okay with console parity.^1 This situation sucks since you are going be paying a significant premium for what is essentially an Xbox/PS5. So you either have to be committed to PC exclusives or your existing PC library. 

But too often this discussion reaches out farther than it has legs for.

- Buying a console because the enthusiast card is high priced. If you are looking at a 4070TI, which is a whole generation ahead of the consoles, I don't see why you would go buy a Xbox instead? You likely wouldn't settle for a 3060 instead of a 4070TI but the consoles are in effect 3060 like in their power. 
 
- If you have an existing PC with an older video card then its broadly cheaper to just upgrade. 3060/6650/A750 all give you console parity for $200ish dollars below console cost. Now obviously the price delta will vary based on your previous hardware and everyone will have their own path. But broadly speaking you can get console parity below console cost *if you have an existing PC*.


Again where the consoles offer a clear advantage is if you are building an entire PC from scratch since the video card will end up being an increasingly large cost and drive up overall cost for just parity. But there is a little bit of the sky is falling going on in these discussions. 

^1 Essentially a PC that can keep up with the console graphics march. For this generation the current console parity card is the 3060/2070. The 4050 *might* be the console parity card but we'll have to see when that releases.",-1,1/8/2023 13:56,FALSE,FALSE,price of GPU are insane,t1_j3e3yc7,,jgewx6r,u/zootofni,"My 1070 amp extreme can still run alot of great games so can game pass.  Hogwarts os great, cyberpunk is great and I didn't need to mess around with settings but on PC I would have gladly done that, just not paying extortion for gpu. I'm certainly not paying 650 for a 0%performance I crease fro. A 3070 to a 4080 in terms of historical.",1,4/15/2023 18:44,FALSE,FALSE,price of GPU are insane,t1_j3e3yc7,,j3faryt,u/ClinicalAttack,"I can imagine the Nvidia board meeting.

Boss: guys, our graphics cards aren't selling, suggestions what to do.

Board member #1: We introduce new products with the exact same name but with different specs and different prices.

Board member #2: We introduce a new ultra premium extreme edition GPU that can render Pixar movies in real-time.

Board member #3: We lower the price of our entire range of GPUs to reasonable levels.

Boss looks angrily at board member #3 and throws him out of the window.",19,1/7/2023 22:46,1/8/2023 0:02,FALSE,price of GPU are insane,t1_j3etvxb,,j3i3olp,u/GoalAccomplished8955,"We've seen price cuts before and I suspect we will see them again. I can afford a new video card but I'm not going to pay the current prices. 

Something to remember is that Nvidia/AMD made projections based off of the pandemic pricing cycle. The drivers of demand are dead but that doesn't mean they are going to roll over immediately. They are going to try to meet those targets and only after failing will they recalibrate.",5,1/8/2023 14:06,FALSE,FALSE,price of GPU are insane,t1_j3etvxb,,jgexg0e,u/zootofni,"Gpu sales down by 20 percent doesn't seem at all bad, it needs to be down by 90 percent.  Down by 20 percent but pricing up 200 to 300% means nvidia is making tones more money than it ever has with these gpus and that's the fing scarey thing about it.  Every one needs to stop buying nvidia gpus and amd gpus.  Sad thin is if battlefield 2141 was any good my moral ground would.turn to mush and I'd ha e bought a 12 to 1400 uknpound nvidia 4080 and hated them for it",1,4/15/2023 18:48,FALSE,FALSE,price of GPU are insane,t1_j3etvxb,,j3g37b8,u/DistractedSeriv,This is not true. The GTX 1080 from the above example was based on the GP104 chip where as the 1080 Ti chip was GP102. Same deal with the 2080 and 2080 Ti. It's the 3000-series that is the odd one out.,10,1/8/2023 3:30,1/8/2023 5:49,FALSE,price of GPU are insane,t1_j3fg4v6,,j3i8cdd,u/tukatu0,"Eh its been half a year mate. Even then crypto burst in decemeber 2021 same time as stock market. I have a feeling that as long as new ampere stock keeps being listed. Nvidia won't change Lovelace prices.


Check back by summer 2023. We should know by then the market is going to be like for the next 2 years.",0,1/8/2023 14:34,FALSE,FALSE,price of GPU are insane,t1_j3g9em0,,jgew5fo,u/zootofni,That's why we are all so mad it's atrocious.,2,4/15/2023 18:38,FALSE,FALSE,price of GPU are insane,t1_jgew36v,,j3f5dnr,u/H0vis,"We're not talking about paying a premium for higher grade components, everybody in the world understands how that works. We're talking about paying an arbitrary surcharge on every graphics card because ""Muh Yacht.""

Every generation of graphics cards improves over those before. Same for motherboards, CPUs, monitors, whatever. None of the people making those have decided arbitrarily that *this particular* incremental improvement warrants doubling the price over six years.

And frankly, if other component manufacturers went the same way, we're done out here. Prices are tied to relative performance of the current generation, not historical comparisons, otherwise it would break down scarily fast.",8,1/7/2023 22:05,FALSE,FALSE,price of GPU are insane,t1_j3f0nlc,,j47wpr1,u/tarheels101,"While this may sound like wisdom to some, it's just plain wrong.  As is generally quite obvious, the *seller* determines the price of any good that is sold.  The only the thing the buyers do (collectively) is determine how many are sold at that price.",0,1/13/2023 14:57,FALSE,FALSE,price of GPU are insane,t1_j3fn94w,,j3er1pu,u/H0vis,"Probably, but I'm not sure the games would be as adaptable as they have to be on PC.",2,1/7/2023 20:18,FALSE,FALSE,price of GPU are insane,t1_j3emy7k,,j3gw4m9,u/H0vis,You get that everybody using cards from 2014 isn't PC gaming in its current form right?,1,1/8/2023 9:14,FALSE,FALSE,price of GPU are insane,t1_j3gqvu2,,j3ha0mf,u/H0vis,"You don't *need* plenty of things, does that mean their price should be doubled?",1,1/8/2023 10:58,FALSE,FALSE,price of GPU are insane,t1_j3h3odx,,j3lvssd,u/H0vis,"Sales are down 20%, which considering the Crypto sector went up in a puff of logic suggests you're not wrong.",1,1/9/2023 8:54,FALSE,FALSE,price of GPU are insane,t1_j3ls3kt,,j92cgu2,u/Mission-Property-498,"You could get a 1440p PC for $700 in 2016 and it wouldn't be that much slower.

[https://www.youtube.com/watch?v=3I2xJLpVAk8](https://www.youtube.com/watch?v=3I2xJLpVAk8)

&#x200B;

The 1070ti actually holds its ground vs the 3060 was fairly similarly priced. The 3060ti was never at MSRP and the 3070ti was often even a little below MSRP. I don't care what tier of GPU something was in or the supposed MSRP. The reality is $375-425 was pretty common for a 3060. And after 5 or so years you hardly get an upgrade in games where pascals architecture doesn't hold up so well like Resident evil there's a good 30-35% advantage for the 3060 but for a lot of games, they're within 14-20% of each other even in recent games like sniper elite 5 which surprised me.

A 70-class card these days is more than a 1080ti was and a 1080ti was probably closer to a full 102 die than a 4070 is/will be.",1,2/18/2023 13:27,FALSE,FALSE,price of GPU are insane,t1_j3sm0vc,,j92czmu,u/Mission-Property-498,"[https://www.youtube.com/watch?v=3I2xJLpVAk8](https://www.youtube.com/watch?v=3I2xJLpVAk8)

&#x200B;

probably closer to a 3060 tbh",1,2/18/2023 13:30,FALSE,FALSE,price of GPU are insane,t1_j41ktx6,,