ID,author,post,score,created_utc,edited,is_submitter,post,parent_id_old\,comments,original_commentjel94e0,[deleted],"Not even that. Nvidia revenue was down >50% y/y. AMD made <1bn in the last quarter from desktop (and maybe laptop too) GPUs.

I personally think last gen AMD cards are still valuable such as 6950XT for 650/700 USD and people still buy 30 series at MSRP. The new cards just kinda don't make any sense, they probably want to capture the high margins before releasing lower tier cards and when the market is saturated they may re-release the same cards with different VRAM for less money or try bundling with games or just price cuts. The same thing happened with 3080 12GB which was sold around the price of 3080 TI but once demand cratered they brought it down to about the price of 3080 10GB. They're playing the long game plus as the article mentions, they make money off data centres (Nvidia) or semi-custom (AMD) so they're in no hurry. They have inventory worth several bn, if it doesn't sell, they'll have no option but to clear stock at reduced prices but that may take a while. It's just a cat and mouse game and consumers will win it in the end.",22,4/1/2023 18:14,FALSE,FALSE,Most PC hardware pricing is back to normal so why not GPUs?,t1_jekfuur,,jel5maf,u/Libir-Akha,Everything's worth what its purchaser will pay for it,19,4/1/2023 17:47,FALSE,FALSE,Most PC hardware pricing is back to normal so why not GPUs?,t1_jekfuur,,jekpg7f,u/bobnine,"Yep, I could pay more for a new gpu today than I spent on my current card 6 years ago and get worse performance...",12,4/1/2023 15:47,FALSE,FALSE,Most PC hardware pricing is back to normal so why not GPUs?,t1_jekfuur,,jekw737,u/cadaada,"Gaming devs are at fault too. The less they optimize their games, the more we will need stronger cards for new techs.....",18,4/1/2023 16:36,FALSE,FALSE,Most PC hardware pricing is back to normal so why not GPUs?,t1_jeki4wb,,jel60k8,u/MonoShadow,"Data center just took over gaming as their biggest money maker. I'm sure ChatGPT/OpenAI and AI race in general will boost them even more. But untill recently gaming was their biggest market. Although how much it was affected by crypto is unknown.


Source:

https://www.nextplatform.com/2022/05/26/datacenter-becomes-nvidias-largest-business/",34,4/1/2023 17:50,FALSE,FALSE,Most PC hardware pricing is back to normal so why not GPUs?,t1_jekcss6,,jelrejl,u/mad-tech,dont forget about the consoles (latest xbox and ps5). huge revenue of AMD came from the consoles. teslas and valve's steamdeck are also part of it.,3,4/1/2023 20:41,FALSE,FALSE,Most PC hardware pricing is back to normal so why not GPUs?,t1_jekcss6,,jemdr05,u/Substance___P,"This is a great point. They only have so much fab space, so they want to schedule all that allocation for the top dollar items.",3,4/1/2023 23:51,FALSE,FALSE,Most PC hardware pricing is back to normal so why not GPUs?,t1_jekcss6,,jelka6j,u/TacticalBeerCozy,"I think people are finally understanding what income inequality looks like. 4090s are not overpriced for some people because $2K is not a meaningful figure. It's not even a consideration. If you got a 20K bonus twice a year you don't care about it. 

It's just noticeable here because its a pc gaming subreddit and you need a GPU far more than slightly faster RAM.",34,4/1/2023 19:43,FALSE,FALSE,Most PC hardware pricing is back to normal so why not GPUs?,t1_jekkixx,,jemx8m1,u/skylinestar1986,"I just bought a used RX470 today. I used to keep up with mid-hi range gaming. Now, my pc is slowly creeping into the r/lowspecgamer category. One day, 1080p will be too expensive for me and I will be back to 720p.",1,4/2/2023 3:36,FALSE,FALSE,Most PC hardware pricing is back to normal so why not GPUs?,t1_jekkixx,,jek7eln,u/born-out-of-a-ball,"So CPU, memory, SDD, etc. makers are not greedy? Only the producers of GPUs?",64,4/1/2023 13:38,FALSE,FALSE,Most PC hardware pricing is back to normal so why not GPUs?,t1_jek00mk,,jekmvre,u/ShuKazun,Nvidia means greediness in Romanian,-2,4/1/2023 15:28,FALSE,FALSE,Most PC hardware pricing is back to normal so why not GPUs?,t1_jek00mk,,jelmjpk,u/veltcardio2,The short and right answer,-1,4/1/2023 20:02,FALSE,FALSE,Most PC hardware pricing is back to normal so why not GPUs?,t1_jek00mk,,jekv9c1,u/Astrophan,Stereopoly,0,4/1/2023 16:29,FALSE,FALSE,Most PC hardware pricing is back to normal so why not GPUs?,t1_jek0j2h,,jekvwq0,u/HorrorScopeZ,"Consoles are always an option, but it is a bit overboard to think everyone needs a 4090 or bust.

So many games play with a much much lower gpu and hey aren't most in agreement that most games that do push gpu's now are unoptimized shit anyway? It's a mixed message, ""I hate AAA games"", ""I have to have the strongest gpu to play new AAA games"", imo screw these poor AAA efforts, to me they don't drive my gaming pleasure. We are seemingly all over the map here.

Intel saving the day? They are only cheap now because they can't compete currently, which is understandable. The moment they become equals, they will (wallstreet will demand) they get proper market value.",26,4/1/2023 16:34,FALSE,FALSE,Most PC hardware pricing is back to normal so why not GPUs?,t1_jekdlaq,,jeknsjv,u/BavarianBarbarian_,"> On the other hand consoles are better than ever so that is always an option.

Yup, this is where it's headed, I think. Damn shame, console gaming just isn't the same with the closed-down ecosystems and basically zero modding capabilities, as well as being forced to re-buy games every other generation or so. But it seems like the big GPU producers have moved or are preparing to move to the ""squeeze the market for all it's worth before dropping it"" stage. It's the most logical explanation for the massive pivot towards other revenue fields and the batshit prices that ensure more than 2/3rds of current PC players will be priced out of the market within the next 2-3 generations.",43,4/1/2023 15:35,FALSE,FALSE,Most PC hardware pricing is back to normal so why not GPUs?,t1_jekdlaq,,jeky7cw,u/__BIOHAZARD___,"We also have the Steam Deck now, which actually is affordable PC gaming. It's great because devs will be targeting lower specs as well",10,4/1/2023 16:51,FALSE,FALSE,Most PC hardware pricing is back to normal so why not GPUs?,t1_jekdlaq,,jel67si,u/ZeroBANG,">  consoles are better than ever so that is always an option.  

can't play my Steam games on Console, so no that is not an option.  
Steam Deck came in clutch though.",3,4/1/2023 17:51,FALSE,FALSE,Most PC hardware pricing is back to normal so why not GPUs?,t1_jekdlaq,,jencvbc,u/JORGETECH_SpaceBiker,"
>On the other hand consoles are better than ever so that is always an option.

With paid online and higher prices on console games you're just moving the money around rather than saving it, I can buy games for cheaper on Steam than I could ever on current gen consoles (even if you buy second hand), you could say that consoles still have the advantage of having ""physical"" releases but nowadays that is not relevant since discs are nothing more than a validation method for DRM that still requires you to download something in order to play the game.",3,4/2/2023 7:18,FALSE,FALSE,Most PC hardware pricing is back to normal so why not GPUs?,t1_jekdlaq,,jellehs,u/TacticalBeerCozy,"> Not everyone can buy a 4090.

Why should they? How many people do you think are actually playing the latest AAA games at 4K/144hz AND stressing about the price tag?

Since when did all of your GPUs become obsolete so you needed a 4xxx series?",1,4/1/2023 19:52,FALSE,FALSE,Most PC hardware pricing is back to normal so why not GPUs?,t1_jekdlaq,,jekzalg,u/Captobvious75,"Its a great option so long as you stick to 60fps games (a massive library so far). A lot of games are getting patches still too (FC5 just got it).

I have a 7900xt PC but still use my PS5 often. Love me some console action.",1,4/1/2023 16:59,FALSE,FALSE,Most PC hardware pricing is back to normal so why not GPUs?,t1_jekdlaq,,jek3tvj,u/wolfannoy,Here comes a new Challenger! artifilic  intelligence using gpu's.,55,4/1/2023 13:13,FALSE,FALSE,Most PC hardware pricing is back to normal so why not GPUs?,t1_jejxzht,,jek14vl,u/AwakenGreywolf,At this point the prices being so high have nothing to do with crypto or even scalpers.,91,4/1/2023 12:55,FALSE,FALSE,Most PC hardware pricing is back to normal so why not GPUs?,t1_jejxzht,,jekizks,u/DerivIT,"Yup! Fuck Crypto and NFTs, those fucking things along with ""Virtual Realestate"" nearly killed VR, luckily that shit is dwindling.",3,4/1/2023 14:59,FALSE,FALSE,Most PC hardware pricing is back to normal so why not GPUs?,t1_jejxzht,,jekxu8w,u/EiffelPower76,"cryptocurrency is not a problem anymore

Moore's law end IS a problem, at least for people that do not accept reality",0,4/1/2023 16:48,FALSE,FALSE,Most PC hardware pricing is back to normal so why not GPUs?,t1_jejxzht,,jelmux4,[deleted],"Hey, man; crypto has ushered in a golden age for internet drug dealers.",0,4/1/2023 20:04,FALSE,FALSE,Most PC hardware pricing is back to normal so why not GPUs?,t1_jejxzht,,jekyede,u/platinums99,Imagine if Jensen hwang is really Sotoshi Nakamura,0,4/1/2023 16:52,FALSE,FALSE,Most PC hardware pricing is back to normal so why not GPUs?,t1_jejxzht,,jeldlim,u/CaptainDouchington,And now Nvidia wants you to build chatbots using their GPUs...,1,4/1/2023 18:50,FALSE,FALSE,Most PC hardware pricing is back to normal so why not GPUs?,t1_jejxzht,,jek8en0,u/-sYmbiont-,"Yup, your fellow gamers are just as much at fault as the guys pricing them.",5,4/1/2023 13:44,FALSE,FALSE,Most PC hardware pricing is back to normal so why not GPUs?,t1_jek7aoc,,jelg5sr,u/Elon_Kums,"Thank fuck Intel is trying to present an actual alternative and not just ""similar but worse features, but they're open source!""",1,4/1/2023 19:10,FALSE,FALSE,Most PC hardware pricing is back to normal so why not GPUs?,t1_jekifgz,,jemr3w1,u/Canadiancookie,"According to the scalping hell of yesteryear, they very much are. That's probably where they got the idea from",1,4/2/2023 2:19,FALSE,FALSE,Most PC hardware pricing is back to normal so why not GPUs?,t1_jekifgz,,jellgt8,u/TacticalBeerCozy,BMW is greedy because I can't afford a new M3,-5,4/1/2023 19:53,FALSE,FALSE,Most PC hardware pricing is back to normal so why not GPUs?,t1_jejxee5,,jemmrg4,u/pulley999,"The difference is the 4090 is actually nearly double the performance of the 3090 for the same inflation-adjusted MSRP.

The rest of the 40 series stack so far isn't nearly as compelling, especially when compared against the used market.",1,4/2/2023 1:26,FALSE,FALSE,Most PC hardware pricing is back to normal so why not GPUs?,t1_jekfn14,,jek009c,[deleted],[deleted],56,4/1/2023 12:47,4/12/2023 6:49,FALSE,Most PC hardware pricing is back to normal so why not GPUs?,t1_jejy7o2,,jek0kdy,u/CurseOfBobbyLayne,Yeah because amd didn't price their shit at 1k too.,5,4/1/2023 12:51,FALSE,FALSE,Most PC hardware pricing is back to normal so why not GPUs?,t1_jejy7o2,,jemqty0,u/Canadiancookie,"I mean, should they be expected to sell them at lower prices for the betterment of the community? It's a high demand luxury product. It's a shame how it is now but we were spoiled in the past with mid tier gpus that were priced as low end",4,4/2/2023 2:16,4/2/2023 2:22,FALSE,Most PC hardware pricing is back to normal so why not GPUs?,t1_jek1385,,jelwoie,u/TacticalBeerCozy,"waah $2000 is a lot to pay to play video games on my 4K monitor, greedy nvidia is to blame! I refuse play below 60fps and ultra settings! thats for poor people!",-2,4/1/2023 21:23,FALSE,FALSE,Most PC hardware pricing is back to normal so why not GPUs?,t1_jek1385,,jep1qwl,u/Tanel88,"Well obviously it's different people. There are people who have the money and don't care about pricing as long as they get the best stuff and GPU makers are fine with selling less at higher margins because they still make the same profit so rest of us are kind of screwed.

Then again you are right that I have enough games to play for years and since I don't care much about AAA games anyway there is really no pressure to upgrade so I can wait.",2,4/2/2023 15:22,FALSE,FALSE,Most PC hardware pricing is back to normal so why not GPUs?,t1_jennoaf,,jek20gl,u/Firefox72,">""better rasterization performance""

To be fair they have exactly 1 GPU that has better raster performance than what AMD has to offer.

But yes on the other stuff they are quite a bit ahead which sadly gives them the chance to just overprice their products",31,4/1/2023 13:01,FALSE,FALSE,Most PC hardware pricing is back to normal so why not GPUs?,t1_jek0sld,,jem0uxu,u/bazooka_penguin,I think AMD's more delusional than nvidia. They're not competitive enough to be only a little cheaper than nvidia's counterparts and it's clear they're not putting in the same level of R&D.,3,4/1/2023 21:58,FALSE,FALSE,Most PC hardware pricing is back to normal so why not GPUs?,t1_jek0sld,,jekavks,u/LordxMugen,"Meh. once Windows 10 stops being supported Im moving on to Arch Linux/SteamOS, where AMD is king. So as long as Nvidia only cares about its proprietary bullshit, I'll stick to more easily supported and usable open source stuff if the only thing Im losing is gimmick AI generated reflections.",1,4/1/2023 14:01,FALSE,FALSE,Most PC hardware pricing is back to normal so why not GPUs?,t1_jek0sld,,jekalcr,u/Noire97z,Intel A770 matched the 3060s in RT. So next generation should be on par with 40 series or better.,0,4/1/2023 13:59,FALSE,FALSE,Most PC hardware pricing is back to normal so why not GPUs?,t1_jek0sld,,jek1uum,u/DemonsRage83,How them boots taste?,-13,4/1/2023 13:00,FALSE,FALSE,Most PC hardware pricing is back to normal so why not GPUs?,t1_jek0sld,,jelhu5d,u/OldBoyZee,Hmm? Kind of reminds me of intel in its glory days - guess what happened to them shortly after.,0,4/1/2023 19:23,FALSE,FALSE,Most PC hardware pricing is back to normal so why not GPUs?,t1_jek0sld,,jek57es,u/Slight-Improvement84,Why is there a Henry Cavill flair,8,4/1/2023 13:23,FALSE,FALSE,Most PC hardware pricing is back to normal so why not GPUs?,t1_jek1b08,,jell2pz,u/TacticalBeerCozy,"Lmao what do you think ""mono"" means?",0,4/1/2023 19:50,FALSE,FALSE,Most PC hardware pricing is back to normal so why not GPUs?,t1_jeka69v,,jeky6ii,u/EiffelPower76,">I sold my 4k monitor and went back to 1440p to extend the life of this gpu

Bad move. With a 4K monitor, you can just play at 1080p without image degradation",3,4/1/2023 16:51,FALSE,FALSE,Most PC hardware pricing is back to normal so why not GPUs?,t1_jekx7ki,,jeor32k,u/Delicious-Tachyons,and my 2070 more than doubled my fps  from my 970 (the one with the gimped memory that could only use 3gb vram out of 4),2,4/2/2023 14:08,FALSE,FALSE,Most PC hardware pricing is back to normal so why not GPUs?,t1_jekkag1,,jekdjo5,u/Slyons89,"Go ahead, elaborate",3,4/1/2023 14:20,FALSE,FALSE,Most PC hardware pricing is back to normal so why not GPUs?,t1_jekcvfh,,jekitrb,u/Several-Elevator,Tell me you didn't read the article without telling me you didn't read the article,0,4/1/2023 14:58,FALSE,FALSE,Most PC hardware pricing is back to normal so why not GPUs?,t1_jekcvfh,,jekjazp,u/Edgaras1103,all  3 of them a multi billion mega corporations,3,4/1/2023 15:01,FALSE,FALSE,Most PC hardware pricing is back to normal so why not GPUs?,t1_jeka9ox,,jekp923,u/Confuciusz,"20 years ago we were playing Warcraft III though. I agree that in terms of raw performance, we've gained an enormous amount. But games' requirements have gone up in much the same way.",3,4/1/2023 15:45,FALSE,FALSE,Most PC hardware pricing is back to normal so why not GPUs?,t1_jeknkj1,,jen3xdn,u/HalflingElf,"Yeah, we should just all convert to console gaming",1,4/2/2023 5:09,FALSE,FALSE,Most PC hardware pricing is back to normal so why not GPUs?,t1_jen281i,,jeknkuy,[deleted],[deleted],461,4/1/2023 15:33,FALSE,FALSE,Most PC hardware pricing is back to normal so why not GPUs?,t1_jekekzi,,jelkj2m,u/Amphax,"The grip of hyper consumerism is too strong.  The minute a card comes out our YouTube feeds are slammed full of reviewers showing off the shiny new cards for us to just buy them then play Vampire Survivors, Minecraft, and CSGO on them anyway...",21,4/1/2023 19:45,FALSE,FALSE,Most PC hardware pricing is back to normal so why not GPUs?,t1_jekekzi,,jekh7lr,u/AgnFr,"Sad but, (seems like) true.",25,4/1/2023 14:46,FALSE,FALSE,Most PC hardware pricing is back to normal so why not GPUs?,t1_jekekzi,,jeksua3,u/Nnnnnnnadie,"The problem is that the developers are starting to take advantage of the more powerful pcs to underedevelop their shit, Last of us port is a good example of that.",28,4/1/2023 16:12,FALSE,FALSE,Most PC hardware pricing is back to normal so why not GPUs?,t1_jekekzi,,jektqb3,u/BuzzBadpants,"That‰Ûªs what the corporatists at the fed want. The labor class is getting too upity for their taste so they want to make sure that only the bourgeois are able to participate in the economy.

They‰Ûªre happy only making 1% of the widgets for the 1%. Yacht companies are not going out of business.",17,4/1/2023 16:18,FALSE,FALSE,Most PC hardware pricing is back to normal so why not GPUs?,t1_jekekzi,,jem5xal,u/TheDrBrian,"We‰Ûªre crashing this market, with no survivors",3,4/1/2023 22:41,FALSE,FALSE,Most PC hardware pricing is back to normal so why not GPUs?,t1_jekekzi,,jenmb99,[deleted],"Maybe. Or maybe AI has such high computing demand that they are happy to focus on that and high end GPUs.

Besides, if you buy a console instead the GPU manufacturers still make money off that.",2,4/2/2023 9:03,FALSE,FALSE,Most PC hardware pricing is back to normal so why not GPUs?,t1_jekekzi,,jelbjur,u/mpga479m,time to downgrade to a 1080p 24‰Û but still 144hz monitor,2,4/1/2023 18:34,FALSE,FALSE,Most PC hardware pricing is back to normal so why not GPUs?,t1_jekekzi,,jempcnd,u/EvilSpirit666,"> Looks like it‰Ûªs time to play chicken.

Get on board. I'm here rocking hardware from 2012",1,4/2/2023 1:57,FALSE,FALSE,Most PC hardware pricing is back to normal so why not GPUs?,t1_jekekzi,,jepwfyr,u/bassbeater,"Dude they sell so many cards just with the whole angle of ""horsepower"" that the price isn't coming down. You've got one brand that is considered consistently behind the mark that it gives people a stigma about buying, and another brand that comes across as really not giving a shit, but steadily issuing updates for their drivers because they care about keeping tight enough margins to get people invested so they have more than just CPUs to push. That's AMD and Intel, respectively.",1,4/2/2023 19:06,FALSE,FALSE,Most PC hardware pricing is back to normal so why not GPUs?,t1_jekekzi,,jerf27i,u/bubblesort33,"Yeah, but 90% of people aren't playing along.",1,4/3/2023 3:40,FALSE,FALSE,Most PC hardware pricing is back to normal so why not GPUs?,t1_jekekzi,,jensej5,u/trizcon97,"There are around 6-7 big car groups, being corporate groups that own several brands.

Competition is artificially inflated this way, however most times groups dont own brands that compete between eachother (think Toyota owns Lexus, but they dont cater to the same audience)",5,4/2/2023 9:57,FALSE,FALSE,Most PC hardware pricing is back to normal so why not GPUs?,t1_jem15m8,,jenfzpz,u/Corax7,What about when we shift to those fully electric cars with batteries. How long do theu last when used? And how locked down are they to fux? You'll need to go to a authorized company with aurhorized battery etc to repair. Cars are going to ve the new smartphones lol,6,4/2/2023 7:56,FALSE,FALSE,Most PC hardware pricing is back to normal so why not GPUs?,t1_jem15m8,,jeoi340,u/AffectionateAd6009,They still exist. Just less profitable so it‰Ûªs not as mainstream anymore,1,4/2/2023 13:06,FALSE,FALSE,Most PC hardware pricing is back to normal so why not GPUs?,t1_jelms07,,jekqg6w,u/ErnestoFazueli,really poor zoning in the US and Canada don't help either. the main issue with housing worldwide is that its rife with speculators and as supply isn't meeting demand speculation won't stop. public housing must be built at a rate that makes it nonsensical treat housing like an easy investment.,33,4/1/2023 15:54,FALSE,FALSE,Most PC hardware pricing is back to normal so why not GPUs?,t1_jekje7f,,jel2znc,u/tickleMyBigPoop,"> No comparison to the housing market, we've been building houses almost the same way for decades

https://fred.stlouisfed.org/graph/?g=124ya",5,4/1/2023 17:27,FALSE,FALSE,Most PC hardware pricing is back to normal so why not GPUs?,t1_jekje7f,,jerulh0,u/Al-Azraq,"Underrated comment. I would add how big ML is becoming as well, otherwise I can't explain why CPUs have much better prices.

We are not their priority anymore and we are doomed to either buy consoles, or be fine with previous generation cards unless some new players comes into the market. Intel could be it, but I guess that as soon as they get some traction they will just act like nVidia and AMD do.

Another thing I can see happening, is that another smaller player can start producing GPUs using cheaper and older nodes. No need to be in the latest node for a GPU to be good.

Of course it will not compete with the latest nVidia and AMD offerings, but they should be cheaper. The problem is that as long as developers keep releasing unoptimised games hoping that we can power through their issues, many people will keep arguing that you need a 4090 or you are not entitled to play.

Anyway, I have enough backlog for centuries so I can keep using my 3070 Ti forever. I do not feel any FOMO with new releases so power to me.",4,4/3/2023 7:21,4/3/2023 7:27,FALSE,Most PC hardware pricing is back to normal so why not GPUs?,t1_jekquyw,,jekzwdh,u/Slyons89,And so they are keeping prices high to maintain revenue rather than dropping prices to increase sales.,2,4/1/2023 17:03,FALSE,FALSE,Most PC hardware pricing is back to normal so why not GPUs?,t1_jekxn9q,,jem9dnn,u/jekpopulous2,"I needed to get a whole new PC for gaming / rendering and had to bite the bullet this year. I ended up with a 4070ti/13700/z690 build for like $1800 and after how savage prices have been the past few years it almost felt like I hit the lottery. On one hand this thing is a beast and DLSS 3 is crazy, on the other I just spent $1800 on a PC with 12GB of vRAM in 2023 like a clown.",33,4/1/2023 23:11,FALSE,FALSE,Most PC hardware pricing is back to normal so why not GPUs?,t1_jekuxj8,,jendrpa,u/Mates1500,"I needed to upgrade from a 1070 after 6 years (I skipped on 30 series because it was unavailable for the longest time, and the prices only stabilized months before 40 series was announced) for 1440p gaming, and despite the meh improvements over 30 series, I still more than tripled my performance in most titles by upgrading to the 4070 Ti. It was only slightly more expensive than a 3080 that has 2 gigs less VRAM, no HW AV1 encode support, about 10% less rasterization performance (which was about equal to the price increase over 3080) and no DLSS3 support. When deciding between the two, I chose the option that made more sense.

Of course you will always have customers with more money than sense, upgrading every single generation for a couple of frames because they have to have the latest and greatest thing out there, just like you have people buying 1600 EUR iPhones every year. But for me, it was a purchase that massively increased performance in every game that used to struggle, easily maxxed out. It's just a shame Nvidia couldn't price it more reasonably, most likely the 30 series customers won't be convinced so easily and they could eventually drop in price due to the low demand.",0,4/2/2023 7:29,FALSE,FALSE,Most PC hardware pricing is back to normal so why not GPUs?,t1_jekuxj8,,jem5dko,u/Lawgamer411,"The 30 series at its launch was a great value and if you could get a xx70/80/90 for their MSRP‰Ûªs they were no brainers. 

The issue is most people didn‰Ûªt. I myself camped online every day for 2 and a half months to get my 3080 for MSRP, but I know for a fact most people: didn‰Ûªt have the time or patience to do so.",7,4/1/2023 22:36,FALSE,FALSE,Most PC hardware pricing is back to normal so why not GPUs?,t1_jel94e0,,jekyhlh,u/Infidel_sg,"Game devs ain't nothing to do when it comes to  idiots w/ money to burn!   Do you remember the MSRP pricing for the 30 series?  Then in come the scalpers who bought up the first runs,    Even then people still had no problem shelling out 2-3 THOUSAND dollars for a card that was 700-900 MSRP.  After that,  Manufacturers didn't remedy the problem, they added to it!",8,4/1/2023 16:53,FALSE,FALSE,Most PC hardware pricing is back to normal so why not GPUs?,t1_jekw737,,jelbf7t,u/gothpunkboy89,"I see gamers on reddit using the term ""optimization"" over and over again but they never seem to be able to quantify what it actually means.",24,4/1/2023 18:33,FALSE,FALSE,Most PC hardware pricing is back to normal so why not GPUs?,t1_jekw737,,jelkgwb,[deleted],A lot of devs get on here and gush about how much easier their life will be when raytracing is mandatory. It really feels to me that devs look at modern hardware as another way to pass costs onto consumers. It means they customer spends more for them to work less.,-3,4/1/2023 19:45,FALSE,FALSE,Most PC hardware pricing is back to normal so why not GPUs?,t1_jekw737,,jely5u1,u/VeganPizzaPie,It's not the devs. It's sales and marketing pushing unrealistic release dates. There literally isn't support for QA and optimization at some companies.,1,4/1/2023 21:36,FALSE,FALSE,Most PC hardware pricing is back to normal so why not GPUs?,t1_jekw737,,