ID,author,post,score,created_utc,edited,is_submitter,post,parent_id_old\,comments,original_comment105lgwm,u/PrashanthDoshi,price of GPU are insane,557,,,,,,562,"Seeing the price of new GPU even mid range going to level of 80 class pricing , do you think that will make people shift to console aa they cost less than a entry level GPU going forward ?"14ec8zx,u/DotabLAH,[HUB] Nvidia and AMD Keep Dropping GPU Prices - June GPU Pricing Update,369,,,,,,219,https://www.youtube.com/watch?v=gb49lnHpKiE126rjun,[deleted],What's going on with Nvidia GPU prices?,3,,,,,,50,[deleted]12vl57c,u/NewArtificialHuman,"GPUs are very expensive nowadays, what would be a reasonable price for a low, mid and high end GPU for you?",6,,,,,,21,"There are a lot of high performance GPUs from the likes of Nvidia and AMD, but few people seem to buy them, they are too expensive! What would be a reasonable price for a high or mid tier GPU, in your opinion?"1134ddq,u/NovaTornado,Why are graphic card prices still so high if they are not selling?,434,,,,,,398,I keep seeing everywhere how the new generation isn't selling and that sales are at lows not seen in decades. It seems awfully dumb to keep selling something at such an expensive price. It seems like a huge loss.128r3j5,u/IHateMyselfButNotYou,Most PC hardware pricing is back to normal so why not GPUs?,927,,,,,,443,https://www.pcgamer.com/most-pc-hardware-pricing-is-back-to-normal-so-why-not-gpus/10jd9xf,u/Stiven_Crysis,GPU Pricing Update: Hardware Still Overpriced?,302,,,,,,251,https://www.techspot.com/article/2611-gpu-pricing-update/124tz2b,u/Worldly_Pound_7625,What are your thoughts on value for money on current gen cards (RTX 40/RX 7000) for RT gaming? Which is better?,405,,,,,,402,titlejovqu4h,u/red286,"Okay, so... old GPUs are dropping in price, and new GPUs are starting to go for MSRP.  This isn't the market collapse that people seem to be pretending is on the verge of happening, this is pricing returning to pre-pandemic norms, where the occasional bottom-end card selling for below MSRP is to be expected, not seen as a unicorn.",145,6/20/2023 17:06,FALSE,FALSE,[HUB] Nvidia and AMD Keep Dropping GPU Prices - June GPU Pricing Update,t3_14ec8zx,,jouk353,u/lurkerbyhq,I hate the Dutch second hand market. I see 6700xt's going for the same price as they cost new now. And yes the new ones are in stock.,89,6/20/2023 12:30,FALSE,FALSE,[HUB] Nvidia and AMD Keep Dropping GPU Prices - June GPU Pricing Update,t3_14ec8zx,,jou45gn,u/ShadowRomeo,"Used market pricing is such a good deal, to the point that going new is pretty much undesirable anymore, yes even factoring the risk when going used.

Going with RTX 3060 Ti selling at $250 or RX 6700 XT at $270 vs RX 7600 new at $260 it is pretty much a no brainer for the first 2 choices even if they are used hands down.",141,6/20/2023 10:43,FALSE,FALSE,[HUB] Nvidia and AMD Keep Dropping GPU Prices - June GPU Pricing Update,t3_14ec8zx,,jouf15m,u/Kermez,I upgraded to 3080 as I was sitting at home during covid. Now I see no need to upgrade again nor to splash so much money when I can spend it on outdoor activities. Like buying handheld!,68,6/20/2023 11:57,FALSE,FALSE,[HUB] Nvidia and AMD Keep Dropping GPU Prices - June GPU Pricing Update,t3_14ec8zx,,jougrmi,u/wh33t,Checks price of 4090 ... still too expensive :(,49,6/20/2023 12:08,FALSE,FALSE,[HUB] Nvidia and AMD Keep Dropping GPU Prices - June GPU Pricing Update,t3_14ec8zx,,jov2kwv,u/wizfactor,"It's pretty telling that the new stuff (4060 Ti, 7600) is already being discounted. Graphics cards are not like SSDs and RAM where the price fluctuates like your usual commodity, which means Nvidia and AMD signed off on these price drops to some extent.

We're currently in a state of consumer chip oversupply, so patient gamers can probably expect some more price drops in the short term. However, there are already rumors that Nvidia (no word yet on AMD) is set to reduce production of consumer chips in order to better match the cold demand for graphics cards. That means the discount party is going to end at some point.

How exactly it ends is hard to predict. It could be that prices will raise back up to MSRP once the undersupply meets the under-demand. Personally, I think Nvidia and AMD will just let these discounts stay the way they are and just replace existing SKUs with ""Super"" refreshes. The ""Super"" SKUs will set a brand new MSRP that are more likely to hold due to no longer being oversupplied, and the existing discounted SKUs will eventually sell out.",18,6/20/2023 14:29,FALSE,FALSE,[HUB] Nvidia and AMD Keep Dropping GPU Prices - June GPU Pricing Update,t3_14ec8zx,,jouxs1g,u/Faluzure,Looks like I‰Ûªll wait another generation. Shits too expensive. I was able to snag a 1080ti for $550 CAD in Nov 2019 and a 4070 will cost more than $900 after taxes for an 80% uplift.,14,6/20/2023 13:58,FALSE,FALSE,[HUB] Nvidia and AMD Keep Dropping GPU Prices - June GPU Pricing Update,t3_14ec8zx,,jox5kmt,u/efadd,"For any active duty, vets, or dependents, armed forces exchanges are selling FE cards below MSRP now. 4090 was like $1519 I think. Also no sales tax, so probably ends up being like $150 savings. 

Of course they didn't start doing that until after I paid $1599+tax at Best Buy for mine.",4,6/20/2023 23:58,FALSE,FALSE,[HUB] Nvidia and AMD Keep Dropping GPU Prices - June GPU Pricing Update,t3_14ec8zx,,jou2pq7,u/imaginary_num6er,[5:56](https://youtu.be/gb49lnHpKiE?t=356) The 4070 is selling pretty well this generation,22,6/20/2023 10:33,FALSE,FALSE,[HUB] Nvidia and AMD Keep Dropping GPU Prices - June GPU Pricing Update,t3_14ec8zx,,jovod3w,u/DexRogue,I'd love to pick up a 7900 XTX and move my 6800 XT to one of my kids PCs but the price to performance is complete trash. $700 and I'm in.,6,6/20/2023 16:50,FALSE,FALSE,[HUB] Nvidia and AMD Keep Dropping GPU Prices - June GPU Pricing Update,t3_14ec8zx,,jovrebm,u/Jacko10101010101,"The mid level came definetely too late, ram too low, expensive... 

Amd is making a refresh that may be ok.",7,6/20/2023 17:10,FALSE,FALSE,[HUB] Nvidia and AMD Keep Dropping GPU Prices - June GPU Pricing Update,t3_14ec8zx,,joy1hvf,u/AncientRaven33,"There ought to be vram slots on gpu's, so user can upgrade to their heart's content. Problem will be solved for otherwise obsolete cards.",3,6/21/2023 6:44,FALSE,FALSE,[HUB] Nvidia and AMD Keep Dropping GPU Prices - June GPU Pricing Update,t3_14ec8zx,,jozgsqd,u/AggnogPOE,4090 down $15. Finally time to buy one.,3,6/21/2023 13:20,FALSE,FALSE,[HUB] Nvidia and AMD Keep Dropping GPU Prices - June GPU Pricing Update,t3_14ec8zx,,jovu321,u/MobileLunch61,Still waiting for a decent price to upgrade my 2070S.,4,6/20/2023 17:29,FALSE,FALSE,[HUB] Nvidia and AMD Keep Dropping GPU Prices - June GPU Pricing Update,t3_14ec8zx,,jow2op6,u/threeeddd,"The gpus are getting alot faster now, and the upgrade cycles will be much longer. 3-4 generation upgrade period will be the norm.

I guess it depends alot on how demanding future games are. VR gaming requires alot of gpu power as well.

price/performance stagnation can't be good for gpu sales. Let's hope next gen will deliver. Or we get some reasonable price cuts this gen. $400 4070, $600 4070ti, $800 4080.",4,6/20/2023 18:30,FALSE,FALSE,[HUB] Nvidia and AMD Keep Dropping GPU Prices - June GPU Pricing Update,t3_14ec8zx,,joxqb6a,u/Iv7301,"I've said this 3 months ago!  When Christmas shopping spree will be in full swing and you'll not believe you eyes! The good thing is that it won't be just this year, big tech companies are facing financial crunch that will linger on for at least another 2-3 years!",2,6/21/2023 4:09,6/21/2023 6:13,FALSE,[HUB] Nvidia and AMD Keep Dropping GPU Prices - June GPU Pricing Update,t3_14ec8zx,,jour7yd,u/omgaporksword,Aussie retailers are artificially keeping pricing high...they simply don't care because nobody is calling them out directly!,5,6/20/2023 13:16,FALSE,FALSE,[HUB] Nvidia and AMD Keep Dropping GPU Prices - June GPU Pricing Update,t3_14ec8zx,,joufpxt,u/VirtuaFighter6,Keep holding out fam! Show these pricks who's boss. Let them sit on those cards. It's going to be a great black Friday.,7,6/20/2023 12:01,FALSE,FALSE,[HUB] Nvidia and AMD Keep Dropping GPU Prices - June GPU Pricing Update,t3_14ec8zx,,joua77o,u/VankenziiIV,"Dlss, Fsr & xess are godsend ... I feel like people might not upgrade so often anymore. Unless Jensen unleashes overdrive on more games and just use fomo.",4,6/20/2023 11:24,FALSE,FALSE,[HUB] Nvidia and AMD Keep Dropping GPU Prices - June GPU Pricing Update,t3_14ec8zx,,jowgtuh,u/bigblackandjucie,"Lol drop?
Prices still expensive ?ÙÇ¡

U know the gpu maktrd prices wherr totally fucked and scammed up when they say its dropping,
But its still expensive lo

I rather throw my pc out the window then supporting this crap gpu matked 
Fucking disgusting companies",4,6/20/2023 20:20,FALSE,FALSE,[HUB] Nvidia and AMD Keep Dropping GPU Prices - June GPU Pricing Update,t3_14ec8zx,,jowf9e8,u/DYMAXIONman,"Folks, do not buy a card with less than 12gb of vram in the current year. lol",4,6/20/2023 20:07,FALSE,FALSE,[HUB] Nvidia and AMD Keep Dropping GPU Prices - June GPU Pricing Update,t3_14ec8zx,,jovd894,u/Blackhawk-388,Where are the prices going down? The Asus 4070 I got for $649 is now $671 on Amazon.,3,6/20/2023 15:38,FALSE,FALSE,[HUB] Nvidia and AMD Keep Dropping GPU Prices - June GPU Pricing Update,t3_14ec8zx,,jovva00,u/EdzyFPS,"Prices remain firm in the UK. Most 4070 GPUs are still 550-600 for cheaper brands and go all the way up to 700. 

Absolute criminal that they just forget their own supply and demand rules when it doesn't go in their favour.

AMD aren't much better here either.

Buying power of our currency has dropped significantly and the cost of living has skyrocketed. 

Shit needs to change fast.",2,6/20/2023 17:37,FALSE,FALSE,[HUB] Nvidia and AMD Keep Dropping GPU Prices - June GPU Pricing Update,t3_14ec8zx,,jowpu8l,u/A2Aegis,Where are the best places to purchase used GPUs?,2,6/20/2023 21:39,FALSE,FALSE,[HUB] Nvidia and AMD Keep Dropping GPU Prices - June GPU Pricing Update,t3_14ec8zx,,jouv2lt,u/MG5thAve,"ZzzZZzz.. wake me up when PC gaming makes sense again. All of the latest games are sub-par ports of Console titles, with resolution bumps and slightly higher quality lighting, but with all kinds of shader compilation issues and stutters. There are a few exceptions with some high-end AAA titles, but nothing that would justify the cost of a modern gaming PC over a PS5 / Series X. Prices are bat shit crazy, coming from a life-long PC gamer who hasn't upgraded from a 980 Ti that I bought secondhand in 2016. I'm rolling with the PS5 for newer games until hardware prices come down, or we get truly unique experiences that can only be achieved on much more powerful hardware.",0,6/20/2023 13:41,FALSE,FALSE,[HUB] Nvidia and AMD Keep Dropping GPU Prices - June GPU Pricing Update,t3_14ec8zx,,jowsv4a,u/Jeep-Eep,Hopefully this is a sign of how the next gen's MSRPs are gonna look.,0,6/20/2023 22:04,FALSE,FALSE,[HUB] Nvidia and AMD Keep Dropping GPU Prices - June GPU Pricing Update,t3_14ec8zx,,jovf7fq,u/Error8890,4090 must good price 1000-1200 usd ..,-2,6/20/2023 15:51,FALSE,FALSE,[HUB] Nvidia and AMD Keep Dropping GPU Prices - June GPU Pricing Update,t3_14ec8zx,,jp14iwe,u/17311422237,It's almost like someone turned saturn into a giant gpu and they became unnecessary,1,6/21/2023 20:13,FALSE,FALSE,[HUB] Nvidia and AMD Keep Dropping GPU Prices - June GPU Pricing Update,t3_14ec8zx,,jowhmyd,u/NoddysShardblade,"Pour one out for the great crypto-crash price slump that never eventuated. 

Instead we're getting a painfully slow return to almost-somewhat-sensible prices (assuming this continues for another year or so).",48,6/20/2023 20:26,FALSE,FALSE,[HUB] Nvidia and AMD Keep Dropping GPU Prices - June GPU Pricing Update,t1_jovqu4h,,joz3c0i,u/detectiveDollar,"The market crash only didn't happen because Nvidia artificially held new pricing at or above MSRP, delayed launches, and increased their new gen pricing.

There simply isn't a supply:demand reason for the 3070 to be 530-570 even *after* the 4070 released, but that's what happened. Only weeks after (when I assume Nvidia gave a rebate) did prices fall.

Not to mention the 3060 and 3050 being *awful* value for nearly an entire year straight. It was baffling to see 3060 TI's going for 430-450 while 3050's were 300 or more. Only like 3 weeks ago did those products dip below their already inflated MSRP's.

AMD delayed launches but continued to lower pricing over time, but it didn't crash the market since AMD's supply is a lot less than Nvidia.

If Nvidia launched Ada in mid Q3 like most expected and the 4080 was 800, it would've absolutely crashed the market.",5,6/21/2023 11:52,FALSE,FALSE,[HUB] Nvidia and AMD Keep Dropping GPU Prices - June GPU Pricing Update,t1_jovqu4h,,jovumnq,u/ea_man,"Same here in Italy, I can get a 6750xt for 370 on amazon and 400e used on ebay. Almost the same with a 6800xt: the sellers are slow.",22,6/20/2023 17:32,FALSE,FALSE,[HUB] Nvidia and AMD Keep Dropping GPU Prices - June GPU Pricing Update,t1_jouk353,,jovx55r,u/Tuned_Out,How long have they been in stock? There was a lull in the US between the time video cards were in stock and used market adjusted.,3,6/20/2023 17:50,FALSE,FALSE,[HUB] Nvidia and AMD Keep Dropping GPU Prices - June GPU Pricing Update,t1_jouk353,,joxxg8p,u/arpaterson,"German second hand market is the same except it‰Ûªs everything. They think their X year old used, out of warranty crap is worth 80-90% of msrp.",6,6/21/2023 5:52,FALSE,FALSE,[HUB] Nvidia and AMD Keep Dropping GPU Prices - June GPU Pricing Update,t1_jouk353,,jov2gtf,[deleted],[deleted],4,6/20/2023 14:28,FALSE,FALSE,[HUB] Nvidia and AMD Keep Dropping GPU Prices - June GPU Pricing Update,t1_jouk353,,joxm8fu,u/raffo000,Is really common to agree to a price even 30% lower of the listing on marktplaats,2,6/21/2023 3:11,FALSE,FALSE,[HUB] Nvidia and AMD Keep Dropping GPU Prices - June GPU Pricing Update,t1_jouk353,,joxx44b,u/stupid_Fly_7641,"europe's second hand market is trash, people want high prices for their cards because they paid a lot 2 years ago.",2,6/21/2023 5:47,FALSE,FALSE,[HUB] Nvidia and AMD Keep Dropping GPU Prices - June GPU Pricing Update,t1_jouk353,,joz4fsj,u/detectiveDollar,"This is surprisingly common for AMD. The used market has a built-in time lag to it, so when AMD is aggressive at cutting New proves, Used prices take time to follow.

There were many points (I'm in the US) during the 2022 proce crash where brand new cards were going for the same as used ones.

Nvidia, meanwhile, artificially held pricing above MSRP for an exceptionally long time. So, used sellers had to slash prices below that because they could not hope to sell them. As a result, buying an Ampere card just before its next gen successor came out is like rolling a new car off the lot. They wanted 530-570 for the 3070 even *after* the 4070 was announced. Today, just 2 months later, there's 3070's on eBay for below 300.

If you take eBay fees and the sales tax you paid for your new card into account, you're getting back less than half the price you paid for it.

AMD by comparison was aggressive at lowering prices so this doesn't happen.",2,6/21/2023 11:59,FALSE,FALSE,[HUB] Nvidia and AMD Keep Dropping GPU Prices - June GPU Pricing Update,t1_jouk353,,jou83hj,u/Nointies,"The current gen price points at the low end just don't make sense, outside of the A750 at $200ish dollars I guess.",61,6/20/2023 11:10,6/20/2023 11:15,FALSE,[HUB] Nvidia and AMD Keep Dropping GPU Prices - June GPU Pricing Update,t1_jou45gn,,jovfc6b,u/Dantai,"> RTX 3060 Ti selling at $250 

I wish Canada was like this, peopel still asking $400CDN for a 3060",13,6/20/2023 15:52,FALSE,FALSE,[HUB] Nvidia and AMD Keep Dropping GPU Prices - June GPU Pricing Update,t1_jou45gn,,jowaxz8,u/Predalienator,My friend bought a used 6700 XT for $207 in Malaysia. He said it smelled like rat poop initially but performs just fine.,6,6/20/2023 19:33,FALSE,FALSE,[HUB] Nvidia and AMD Keep Dropping GPU Prices - June GPU Pricing Update,t1_jou45gn,,jouwdno,u/Apd0x,"Nowadays everytime I'm in the market to buy a new gpu I usually wait for the new nvidia gen and then buy a used last gen xx80 gpu for cheap.

It worked pretty well with my last 2 cards (1080ti, 3080).

There's just no way for me to justify spending 1k+ on a gpu alone, and I'm someone who usually buys pricier products.",18,6/20/2023 13:49,FALSE,FALSE,[HUB] Nvidia and AMD Keep Dropping GPU Prices - June GPU Pricing Update,t1_jou45gn,,jov7oyg,u/The_Chronox,"I just saw a 3080 12GB for $420 on my local Craigslist, the times are good

(Relative to before)",8,6/20/2023 15:02,FALSE,FALSE,[HUB] Nvidia and AMD Keep Dropping GPU Prices - June GPU Pricing Update,t1_jou45gn,,jow123n,u/Stratty88,"If you‰Ûªre going ultra budget, 980ti‰Ûªs/titans are going for maybe $60-80, and there‰Ûªs a lot of them. They‰Ûªre old, for sure, but pretty capable, especially if you don‰Ûªt play the latest AAA thing.",2,6/20/2023 18:18,FALSE,FALSE,[HUB] Nvidia and AMD Keep Dropping GPU Prices - June GPU Pricing Update,t1_jou45gn,,joufvh2,u/Vitosi4ek,"I'm seriously considering the 4060 once it comes out, depending on the reviews of course. My usecase is a 2560x1080 200Hz monitor that I want to drive the latest AAA games on (high settings with at least 60 FPS, more if possible). Currently I have a 5700XT and it struggles in some new games quite a bit, and FSR2 is absolutely terrible at 1080p-class resolutions so I can't use it. I'm hoping a 4060 can drive at least 60 FPS on its own or with DLSS help (since it's far better at this res) and then framegen it up closer to the monitor's refresh rate.",-3,6/20/2023 12:02,FALSE,FALSE,[HUB] Nvidia and AMD Keep Dropping GPU Prices - June GPU Pricing Update,t1_jou45gn,,joz7xs8,u/detectiveDollar,"Due to AMD's aggressive New pricing, I actually don't find it that much worth it.

For example, the 6700 XT brand new is 310 and comes with a game.

The 6600 is 180 with a game, and last time I checked, they were like 160 at the cheapest on eBay.",1,6/21/2023 12:22,FALSE,FALSE,[HUB] Nvidia and AMD Keep Dropping GPU Prices - June GPU Pricing Update,t1_jou45gn,,jovy4sf,u/jai_kasavin,">handheld

Genuinely asking what the use case is for handheld, why the explosion of steamdeck and that whole segment. Is it people who commute.",17,6/20/2023 17:57,FALSE,FALSE,[HUB] Nvidia and AMD Keep Dropping GPU Prices - June GPU Pricing Update,t1_jouf15m,,joux631,u/zublits,"It's a halo product, and is actually a decent deal looking at previous Nvidia halo products price/performance. It won't likely drop much. 

I'd like to see the 4080 drop a lot more. The pricing is criminal.",71,6/20/2023 13:54,FALSE,FALSE,[HUB] Nvidia and AMD Keep Dropping GPU Prices - June GPU Pricing Update,t1_jougrmi,,jowo4p4,u/cp5184,"And almost faster than a high power limit 7900xtx...  Just a little faster and you could call it a 7900xtx killer...

If that's not worth $2000+ I don't know what is...",1,6/20/2023 21:24,FALSE,FALSE,[HUB] Nvidia and AMD Keep Dropping GPU Prices - June GPU Pricing Update,t1_jougrmi,,joxd7q5,u/antiprogres_,it's worth it,0,6/21/2023 1:19,FALSE,FALSE,[HUB] Nvidia and AMD Keep Dropping GPU Prices - June GPU Pricing Update,t1_jougrmi,,jows7wa,u/Vushivushi,"My forecast is that even as last-gen inventory thins out, they'll let current prices ride out through the holidays, leveraging game promotions to help carry some value. 

The discount party will continue ad-hoc if sales aren't doing well enough through the holiday. The retail side will not be happy about carrying inventory that isn't selling and supply will be higher during the holiday. If sales aren't good enough exiting the holidays, it doesn't get better over time. Seasonality going through the first half of a year will only see weaker sales.

Nvidia recently said that they're observing upgrade cycles to be about 3-3.5 years. The RTX 3060 was available in late February 2021. So not only are we in a down-cycle due to the inventory glut, we're not yet in the upgrade cycle for last-gen users. 

I agree. I think a mid-gen refresh is likely next year. 

Also, if Nvidia is expecting to grow in the datacenter, it's not only H100/A100 that they'll be selling. The L4 will likely be their top selling inference card, like the T4 was. That means they'll be producing lots of AD104 to bin for the L4. Overtime, supply of defective GPUs will build up and a mid-gen refresh will be needed to sell the resulting cut-down, AD104-based GPUs.",4,6/20/2023 21:59,FALSE,FALSE,[HUB] Nvidia and AMD Keep Dropping GPU Prices - June GPU Pricing Update,t1_jov2kwv,,jowl368,u/NoiseSolitaire,"> ...set to reduce production of consumer chips in order to better match the cold demand for graphics cards.

Demand is high; it's just sales that are low due to the ridiculous pricing. $500 for a 4060 Ti 16GB?  Are they out of their f*#&ing mind?!

If these products weren't simply terrible value, and were priced reasonably, they *would* be selling.",10,6/20/2023 20:53,FALSE,FALSE,[HUB] Nvidia and AMD Keep Dropping GPU Prices - June GPU Pricing Update,t1_jov2kwv,,jovwnlt,u/ea_man,"Not only it's expensive, it's also not future proof with too little vRAM.",7,6/20/2023 17:46,FALSE,FALSE,[HUB] Nvidia and AMD Keep Dropping GPU Prices - June GPU Pricing Update,t1_jouxs1g,,jou93xk,u/capn_hector,"It‰Ûªs selling very well according to mindfactory‰Ûªs numbers, they‰Ûªre kinda downplaying that one a bit.

It‰Ûªs the top selling card on mindfactory by like, a 50% margin over the next highest (6700XT), and has been there for weeks. Some weeks it‰Ûªs double, which is extremely good given that it‰Ûªs mindfactory and literally twice the price.

https://reddit.com/r/Amd/comments/14d0ffe/graphics_cards_retail_sales_week_24_2023/

https://twitter.com/TechEpiphany/status/1667537641288417283",42,6/20/2023 11:17,6/23/2023 11:59,FALSE,[HUB] Nvidia and AMD Keep Dropping GPU Prices - June GPU Pricing Update,t1_jou2pq7,,joza6ut,u/detectiveDollar,"4070 is the best positioned card for most people.

4090 is out of reach for most, 4080 is out of reach for most with relatively poor value. 4070 TI is overpriced with less VRAM/performance than the competition. 4060 TI is 10-15% faster than the 3060 TI at best and drops to -5% to 5% faster at the resolutions buyers will actually use it for (and that's if you have PCIe 4.0)

4070 is 30% faster than the 3070, has 50% more VRAM, and lower power consumption. Unlike the more expensive cards, the only competition from AMD are last-gen high-end cards, which means *drastically* higher power consumption. While RDNA3 isn't *that* much more inefficient than Ada, RDNA2 is a lot more inefficient. The difference in absolute watts is large enough that many 600 dollar GPU buyers will need to get a new PSU if they get a 6950 XT over a 4070.

The 4070 *really* should've been a 500 dollar card, but even now, it's the best positioned of the Ada line, even if it's value is kind of garbage by historical standards.",3,6/21/2023 12:37,FALSE,FALSE,[HUB] Nvidia and AMD Keep Dropping GPU Prices - June GPU Pricing Update,t1_jou2pq7,,joxxl3b,u/stupid_Fly_7641,"because for everybody that doesn't have an rtx 3000 card it is still a good upgrade. Sure you are paying 100 usd more than ""it should cost"" but does that make such a big difference when you are coming from a 1070 or something like that",2,6/21/2023 5:53,FALSE,FALSE,[HUB] Nvidia and AMD Keep Dropping GPU Prices - June GPU Pricing Update,t1_jou2pq7,,joxelgw,u/doneandtired2014,"Might be a while for the XTX to hit that price as anything other than an open box, but a new XT isn't too far off the mark right now.",4,6/21/2023 1:35,FALSE,FALSE,[HUB] Nvidia and AMD Keep Dropping GPU Prices - June GPU Pricing Update,t1_jovod3w,,joyhyxv,u/ListenBeforeSpeaking,"There are form factor (heat sink and slot) issues as well as signal integrity issues (speed) that have a tradeoff to do this.   
  
In this particular case, there are technical reasons this doesn‰Ûªt happen.     If we re-designed the ATX standard and PCIe interface, we could likely find a solution where this tradeoff is more manageable.",2,6/21/2023 9:20,FALSE,FALSE,[HUB] Nvidia and AMD Keep Dropping GPU Prices - June GPU Pricing Update,t1_joy1hvf,,jp599ir,u/obiwansotti,"the value increase for the 40 series is absolutely gross. They did improve value if you want to spend $1000+, but who wants to do that. Everything from $700 and under is basically the same value as the 30 series, so where you see 20% more perf, you see a 20% increase in price.

If nvidia wants to sell 50 series cards, they need to make them a major value improvement.",1,6/22/2023 17:39,FALSE,FALSE,[HUB] Nvidia and AMD Keep Dropping GPU Prices - June GPU Pricing Update,t1_jow2op6,,jozbaie,u/detectiveDollar,"Typically, it's either the AIB's or distributors in these cases. Retailers make infamously low margins on the flagship/doorbuster products.

Oftentimes, the retailer is afraid to slash prices and sell the product because now they have to chase down the AIB for a rebate after the fact.

Or they have a contract where they need to order a certain amount, but with a cap on how many they are forced to have on hand. In this case, by *not* selling the product for a loss, they can force the AIB to give them a rebate as they can not take anymore product.

We saw this gane a chicken a lot, where Nvidia GPU's sharply dropping in price out of nowhere anong all retailers at the exact same time, which means this was a decision by a larger party than the individual retailer.",2,6/21/2023 12:44,FALSE,FALSE,[HUB] Nvidia and AMD Keep Dropping GPU Prices - June GPU Pricing Update,t1_jour7yd,,