ID,author,post,score,created_utc,edited,is_submitter,post,parent_id_old\,comments,original_commentje4cg6j,u/Robochemist1234,"I'm more mad at AMD. I expect ""screw you, pay me"" behavior from Nvidia. They usually have the quality to back up their arrogance. I'm a car guy (PC's are the toys I can actually afford). Ferrari is the same way. I've heard their dealers treat customers like a piece of crap (Jay Leno refuses to buy one), but they keep their product desirable such that people put up with it. 

That's a little too much hubris from Nvidia IMO. Panties stay firmly in place no matter how many slots a big girthy graphics card can fill.",5,3/29/2023 5:45,FALSE,FALSE,What are your thoughts on value for money on current gen cards (RTX 40/RX 7000) for RT gaming? Which is better?,t1_je37rdw,,je4at32,u/Purple_Form_8093,The crappy Gpu sales might iron pricing out next generation but everyone is afraid of recession so we are getting milked in advance.,2,3/29/2023 5:20,FALSE,FALSE,What are your thoughts on value for money on current gen cards (RTX 40/RX 7000) for RT gaming? Which is better?,t1_je37rdw,,je3zfl5,u/auditionko,Imo its not worth voting with my money when im sacrificing my gaming experience for it. There is no alternative for rtx4xxx series if you want RT atm.,1,3/29/2023 2:36,FALSE,FALSE,What are your thoughts on value for money on current gen cards (RTX 40/RX 7000) for RT gaming? Which is better?,t1_je37rdw,,je45stf,u/Playful_Weekend4204,That's not much better than a 4070Ti/7900 XT for $800-850...,4,3/29/2023 4:05,FALSE,FALSE,What are your thoughts on value for money on current gen cards (RTX 40/RX 7000) for RT gaming? Which is better?,t1_je3n8kp,,je2hhqv,u/---fatal---,">Terrible is a stretch. 7000 series has some driver issues in a few specific VR titles.

It's generally slower, in a lot of cases it's slower than 6000 series.

6000 series is fine. Again, look at reviews.

&#x200B;

>I'm not seeing this anywhere.

lol, the net is full of the idle power consumption and it is by design, look it up (multi-monitor setups and max vram clock).

On the 7 series there is (or was) an issue with some single monitor high refresh rate monitors, there was even a known issue (or there is, I haven't followed driver changes recently).

But the max vram frequency with high refresh rate multi-monitor setups is by design since RDNA1.

And I have direct experience with this.

I never said there are no driver issues on nvidia cards.

I'm not an AMD hater, I've used multiple AMD cards in the past. I also have AMD CPU currently (and the previous one was AMD as well).",-7,3/28/2023 18:49,FALSE,FALSE,What are your thoughts on value for money on current gen cards (RTX 40/RX 7000) for RT gaming? Which is better?,t1_je2g2qz,,je47h3a,[deleted],"Welll, I have a 7900xt and yes, I get high idle power usage with my dual monitors (90-100W just on desktop with nothing open)

Depending on driver versions I can sometimes get it down to a more sensible 30-40W by fiddling with timing settings, refresh rate, etc, but which one works  and how well seems to be entirely random so far.

This is listed as a known issue on AMD's own download page.",1,3/29/2023 4:30,FALSE,FALSE,What are your thoughts on value for money on current gen cards (RTX 40/RX 7000) for RT gaming? Which is better?,t1_je2g2qz,,je1048n,u/Low-Arrival-4184,"Nah not at 4k & dlss quality w/ all settings maxed. I like to keep a stable 144 with amazing graphics. I get that with most games most times, but with RT off I always have perfect frames. Don‰Ûªt really notice it tbh outside of CP2077",79,3/28/2023 13:08,FALSE,FALSE,What are your thoughts on value for money on current gen cards (RTX 40/RX 7000) for RT gaming? Which is better?,t1_je0zn88,,je0zp0g,u/Worldly_Pound_7625,Just turn it on and forget it lol,-6,3/28/2023 13:06,FALSE,TRUE,What are your thoughts on value for money on current gen cards (RTX 40/RX 7000) for RT gaming? Which is better?,t1_je0zn88,,je2y52r,u/throwawayzdrewyey,It does look amazing with it on but I didn‰Ûªt build a pc to get console fps. I‰Ûªm probably just spoiled but I can‰Ûªt play anything under 60 fps anymore.,1,3/28/2023 20:51,FALSE,FALSE,What are your thoughts on value for money on current gen cards (RTX 40/RX 7000) for RT gaming? Which is better?,t1_je2kf5l,,je3601q,u/NoDescription8016,"I agree. Control got me interested in RT. Played it 1080p and could notice the changes. Made me want to play it in 4k that way. It‰Ûªs the only game other the. CP that you would wanna have RT in sadly. For that reason, I‰Ûªm going with the XTX which is fine for 1440p RT like the 6k series was better for 1080p RT unless you MAYBE have a 6900xt.",0,3/28/2023 21:50,FALSE,FALSE,What are your thoughts on value for money on current gen cards (RTX 40/RX 7000) for RT gaming? Which is better?,t1_je2kf5l,,je5nvhh,u/throwawayzdrewyey,"Nearly every game I turn off dlss, it typically gives me a little fps boost but at the expense of quality picture.",1,3/29/2023 12:19,FALSE,FALSE,What are your thoughts on value for money on current gen cards (RTX 40/RX 7000) for RT gaming? Which is better?,t1_je49s4t,,je1j7o6,u/SSABM,More devoted to RT than 40K Imperium of Man is to their emperor,23,3/28/2023 15:07,FALSE,FALSE,What are your thoughts on value for money on current gen cards (RTX 40/RX 7000) for RT gaming? Which is better?,t1_je1efzc,,je1lefu,u/Worldly_Pound_7625,"Well, can't live without downvotes on Reddit. If this keeps up, I might be banned from this sub LMAO. I already can't post or comment in r/pcgaming and this pretty much ensures it will stay that way.",-4,3/28/2023 15:21,FALSE,TRUE,What are your thoughts on value for money on current gen cards (RTX 40/RX 7000) for RT gaming? Which is better?,t1_je1efzc,,je1dxvc,u/sleepy_the_fish,Exactly bro !,5,3/28/2023 14:34,FALSE,FALSE,What are your thoughts on value for money on current gen cards (RTX 40/RX 7000) for RT gaming? Which is better?,t1_je0z7af,,je12nke,u/Worldly_Pound_7625,"Also the only game I know that has really good reflections without RT is Stray, which I think uses planar reflections.",0,3/28/2023 13:24,FALSE,TRUE,What are your thoughts on value for money on current gen cards (RTX 40/RX 7000) for RT gaming? Which is better?,t1_je0z7af,,je0zefi,u/Worldly_Pound_7625,"DLSS is really good in Fortnite, I play at 1080p with DLSS quality and I still don't notice it",-1,3/28/2023 13:04,FALSE,TRUE,What are your thoughts on value for money on current gen cards (RTX 40/RX 7000) for RT gaming? Which is better?,t1_je0z7af,,je0z7bk,u/Worldly_Pound_7625,"Yes but I still get around 100 FPS with DLSS quality (which is very well implemented in Fortnite and looks indistinguishable from native res), and it's not like I'm an eSports pro or something who needs every last frame they can get. I play pretty casually.",4,3/28/2023 13:02,FALSE,TRUE,What are your thoughts on value for money on current gen cards (RTX 40/RX 7000) for RT gaming? Which is better?,t1_je0ynyr,,je28b73,u/RChamy,"Re4 remake and Dead Space remake use mostly RT reflections and RTAO, now, when a game uses global ilumination it hits HARD",2,3/28/2023 17:44,FALSE,FALSE,What are your thoughts on value for money on current gen cards (RTX 40/RX 7000) for RT gaming? Which is better?,t1_je0z45g,,je2kyuz,u/scylk2,Really depends on the game.,1,3/28/2023 19:14,FALSE,FALSE,What are your thoughts on value for money on current gen cards (RTX 40/RX 7000) for RT gaming? Which is better?,t1_je0z45g,,jepcx75,u/Worldly_Pound_7625,Also Nanite eliminates LOD pop-in (which is especially noticeable in performance mode) and as a result increases immersion.,2,4/2/2023 16:41,FALSE,TRUE,What are your thoughts on value for money on current gen cards (RTX 40/RX 7000) for RT gaming? Which is better?,t1_jeabp4n,,je90cut,u/Worldly_Pound_7625,"But the latency increase is very small, due to Reflex being forced on in the process. Also, it can boost FPS in CPU bound scenarios, as shown in MSFS. And the artifacting because of less (or inaccurate) information usually occurs when the camera is moving weirdly, like when Spider-Man jumps out of the window in the opening cutscene of Spider-Man Remastered. It's usually not noticeable or only noticeable for a split second and can be fixed by not generating frames in those scenarios. But of course, that's up to Nvidia to fix.",1,3/30/2023 4:23,FALSE,TRUE,What are your thoughts on value for money on current gen cards (RTX 40/RX 7000) for RT gaming? Which is better?,t1_je8wk6t,,je26vk8,u/Hollowpoint38,You can't buy that kind of brand loyalty. That's like magic almost.,7,3/28/2023 17:35,FALSE,FALSE,What are your thoughts on value for money on current gen cards (RTX 40/RX 7000) for RT gaming? Which is better?,t1_je21mol,,je2dugz,u/sL1NK_19,Then I must be a fusion of Strix and EVGA lol,1,3/28/2023 18:23,FALSE,FALSE,What are your thoughts on value for money on current gen cards (RTX 40/RX 7000) for RT gaming? Which is better?,t1_je21mol,,je2g2h6,u/HolyAndOblivious,"exactly. First iteration of RT games suck and DLSS sucked too. We were overpaying for a 8gb 1080ti. Now? DLSS doesnt suck and some games implemented RT properly and its 60fps playable on native resolutions.

Hindsight is 20/20 but goddamn, turing ended up to being a great generation. 30 series was unobtanium at MSRP and the 40 series is just overpriced.",0,3/28/2023 18:39,FALSE,FALSE,What are your thoughts on value for money on current gen cards (RTX 40/RX 7000) for RT gaming? Which is better?,t1_je2819y,,je2fr1f,u/Hopperbus,"Well over 20% of people on the Steam Hardware Survey have a 3000 series GPU so a few people might have purchased a computer outside of you.

Think it's probably more people are building their own PC or going to bigger pre-built companies to get their gaming PC's these days.",12,3/28/2023 18:36,FALSE,FALSE,What are your thoughts on value for money on current gen cards (RTX 40/RX 7000) for RT gaming? Which is better?,t1_je2aejt,,je366mz,[deleted],"Even a short term memory of the past ~5 years would let anyone see a pattern of rising and sinking cryptocurrency values across a variety of coins. As value goes up, so does the incentive to mine, which means more GPUs being bought by miners, so on and so forth. You're also completely ignoring scalping which played a major role in the shortage of moderately priced cards. 

Also, building computers is easier than ever. Someone could flip on a YouTube video and do it themselves in a day. Less than that even. So maybe the reason you're not getting inquiries is because people are just throwing on a guide from Linus Tech Tips or something and doing it themselves. Its a brave new world out there, time to pivot.",5,3/28/2023 21:52,FALSE,FALSE,What are your thoughts on value for money on current gen cards (RTX 40/RX 7000) for RT gaming? Which is better?,t1_je2aejt,,je2fuk4,u/Recyclops1989,"You‰Ûªre aware that there are a load of different cryptos one could mine. One just needs to pick up value again. Like how Bitcoin did and then ETH. Not saying it will, but I wouldn‰Ûªt rule it out entirely.",-2,3/28/2023 18:37,FALSE,FALSE,What are your thoughts on value for money on current gen cards (RTX 40/RX 7000) for RT gaming? Which is better?,t1_je2aejt,,je3lfz5,u/S1imSkit,"""Mining is DEAD""
Lmao",-5,3/28/2023 23:59,FALSE,FALSE,What are your thoughts on value for money on current gen cards (RTX 40/RX 7000) for RT gaming? Which is better?,t1_je2aejt,,je28n0r,u/RChamy,We need GDDR7 fast,2,3/28/2023 17:47,FALSE,FALSE,What are your thoughts on value for money on current gen cards (RTX 40/RX 7000) for RT gaming? Which is better?,t1_je25szw,,je4bj5a,u/Worldly_Pound_7625,Yeah but those are in unoptimized games like Hogwarts Legacy. Man if they aren't optimizing performance (relying on DLSS to save them) at least optimize VRAM usage lol,1,3/29/2023 5:31,FALSE,TRUE,What are your thoughts on value for money on current gen cards (RTX 40/RX 7000) for RT gaming? Which is better?,t1_je25szw,,je3ryfc,u/I_say_aye,"Apparently according to this site, inflation is 25% since 2016 when the 1070 came out: https://www.usinflationcalculator.com/

So we should expect around 500, which is still way lower than what people are expecting the 4070s to sell at",3,3/29/2023 1:05,FALSE,FALSE,What are your thoughts on value for money on current gen cards (RTX 40/RX 7000) for RT gaming? Which is better?,t1_je2suzi,,je3zw0v,u/FrozenMongoose,"You did not account for inflation. 

$400 in May 2016 (when the 1070 was released) is worth $500 today...

Yes it is overpriced, but you should be realistic.",3,3/29/2023 2:42,3/29/2023 2:46,FALSE,What are your thoughts on value for money on current gen cards (RTX 40/RX 7000) for RT gaming? Which is better?,t1_je2suzi,,je2tda8,u/Diligent_Pie_5191,That would be a perfect price for that card,2,3/28/2023 20:16,FALSE,FALSE,What are your thoughts on value for money on current gen cards (RTX 40/RX 7000) for RT gaming? Which is better?,t1_je2suzi,,je4bxpi,u/Worldly_Pound_7625,"I have both and still play bedrock, I only play Java when I want Hypixel. Redstone isn't really a concern to me because I don't know shit about it.",0,3/29/2023 5:37,FALSE,TRUE,What are your thoughts on value for money on current gen cards (RTX 40/RX 7000) for RT gaming? Which is better?,t1_je3wboj,,je0xh3r,u/keyboredYT,"Most rendering engines support GPU accelerated RT (via Tensors, not rasterization conversion) nowadays. I use it a lot in my Autodesk suite to make the designs I create more realistic/appealing. It's one of the first thing Nvidia implemented 4 years ago.

Blender Cycles supports it too. With OptiX denoiser too. 
https://youtu.be/itNWdv2Fu-0",10,3/28/2023 12:52,FALSE,FALSE,What are your thoughts on value for money on current gen cards (RTX 40/RX 7000) for RT gaming? Which is better?,t1_je0wqxp,,je0x9l5,u/Worldly_Pound_7625,"Also the RTX platform doesn't mean anything, it's just branding. They all use DXR for the actual ray tracing which isn't biased towards any brand of GPU, it just depends on how good a cards RT cores (or ray accelerators in AMD's case) are.",0,3/28/2023 12:50,FALSE,TRUE,What are your thoughts on value for money on current gen cards (RTX 40/RX 7000) for RT gaming? Which is better?,t1_je0wqxp,,je33u0u,u/imtougherthanyou,...you said dlss 3...,6,3/28/2023 21:34,FALSE,FALSE,What are your thoughts on value for money on current gen cards (RTX 40/RX 7000) for RT gaming? Which is better?,t1_je1ro49,,je24twl,u/Worldly_Pound_7625,Yeah that's about right. It is what DLSS is doing after all.,0,3/28/2023 17:21,FALSE,TRUE,What are your thoughts on value for money on current gen cards (RTX 40/RX 7000) for RT gaming? Which is better?,t1_je1zqbf,,je2ezri,u/obj_Obj,"Light simulation has existed a long time before ray tracing. It‰Ûªs called path tracing, and runs on regular gpu cores",0,3/28/2023 18:31,FALSE,FALSE,What are your thoughts on value for money on current gen cards (RTX 40/RX 7000) for RT gaming? Which is better?,t1_je2543l,,je4cqrr,u/iamnotnima,"And that's just it. Yet, when you're playing, you don't notice them that much. RT isn't worth it. There are more important things right now than a technology in its infancy. Maybe 6000 Nvidia and 9000 AMD cards will be strong enough. I traded my 3070 ti for an RX 6800, and all I can say is that I'm happy I did. 3070 ti may do better RT, however meaningless and insignificant, 6800 is better in raster. Plus, due to higher VRAM, it does RT better in some games where 3070 ti can run out of VRAM.",2,3/29/2023 5:49,FALSE,FALSE,What are your thoughts on value for money on current gen cards (RTX 40/RX 7000) for RT gaming? Which is better?,t1_je4aq8m,,je6d7ah,u/Worldly_Pound_7625,"Ok ok I'm excited. I honestly think this PC buying thing won't happen anytime soon, because currently other things are on top of our priority list, such as going on a holiday in Norway for a few days.",1,3/29/2023 14:59,FALSE,TRUE,What are your thoughts on value for money on current gen cards (RTX 40/RX 7000) for RT gaming? Which is better?,t1_je5els3,,je4b2wr,u/Worldly_Pound_7625,"Yeah man, I'm looking back and seeing what a fool I was for telling people to wait for 40 series. I expected a max $100 price increase across the board, this is just insanity",5,3/29/2023 5:24,FALSE,TRUE,What are your thoughts on value for money on current gen cards (RTX 40/RX 7000) for RT gaming? Which is better?,t1_je396ex,,je8xh5w,u/bruhtherG,Wont happen i think. only prices up to the sky from here on,1,3/30/2023 3:40,FALSE,FALSE,What are your thoughts on value for money on current gen cards (RTX 40/RX 7000) for RT gaming? Which is better?,t1_je396ex,,je4d5ut,u/Robochemist1234,"The 4090 is a tempting buy. It pisses me off that the industry is clearly manipulating people to see the halo tier cards as good value. They actually are because the value sucks everywhere else.

The Titan class has historically been a poor value proposition; 2-3x higher cost for 5% higher performance. The 4090 actually makes sense if you've got the rest of the hardware to utilize it. Hell, I might bite if they make a high refresh super UW monitor (7680x2160).",-2,3/29/2023 5:55,FALSE,FALSE,What are your thoughts on value for money on current gen cards (RTX 40/RX 7000) for RT gaming? Which is better?,t1_je3zfl5,,je2l02t,u/itsfortybelow,"When you're making claims, it's on you to provide sources, not tell people to look it up.",14,3/28/2023 19:14,FALSE,FALSE,What are your thoughts on value for money on current gen cards (RTX 40/RX 7000) for RT gaming? Which is better?,t1_je2hhqv,,je2gfa6,[deleted],[deleted],1,3/28/2023 18:41,FALSE,FALSE,What are your thoughts on value for money on current gen cards (RTX 40/RX 7000) for RT gaming? Which is better?,t1_je1048n,,je1095c,u/Worldly_Pound_7625,Frame generation exists,-85,3/28/2023 13:09,FALSE,TRUE,What are your thoughts on value for money on current gen cards (RTX 40/RX 7000) for RT gaming? Which is better?,t1_je1048n,,je2jnku,u/scylk2,Crazy that you still need DLSS with a 4090,1,3/28/2023 19:04,FALSE,FALSE,What are your thoughts on value for money on current gen cards (RTX 40/RX 7000) for RT gaming? Which is better?,t1_je1048n,,je3m5vy,u/scylk2,"Hellblade Senua's Sacrifice is another game where RT looks really good.  
I've also heard good things about Metro exodus",2,3/29/2023 0:06,FALSE,FALSE,What are your thoughts on value for money on current gen cards (RTX 40/RX 7000) for RT gaming? Which is better?,t1_je3601q,,je6abz5,u/Worldly_Pound_7625,"DLSS 2 is very advanced, I don't notice it most of the time and sometimes it looks better than TAA.",2,3/29/2023 14:41,FALSE,TRUE,What are your thoughts on value for money on current gen cards (RTX 40/RX 7000) for RT gaming? Which is better?,t1_je5nvhh,,je1lw0v,u/Worldly_Pound_7625,"Well, looks like my parents made a mistake when buying me a PC with an RTX 3080 that came with a 1080p monitor, because I now have the most unpopular opinion known to mankind",-8,3/28/2023 15:24,FALSE,TRUE,What are your thoughts on value for money on current gen cards (RTX 40/RX 7000) for RT gaming? Which is better?,t1_je1j7o6,,je1lh1n,u/Worldly_Pound_7625,Gotta love living in negative comment karma hell with no way to raise it.,-1,3/28/2023 15:21,3/28/2023 15:26,TRUE,What are your thoughts on value for money on current gen cards (RTX 40/RX 7000) for RT gaming? Which is better?,t1_je1lefu,,je10gpu,u/InBlurFather,"1080p is where you‰Ûªd definitely notice it, if you don‰Ûªt that‰Ûªs great but in general you don‰Ûªt want to have to rely on upscaling unless you‰Ûªre playing 4k and upscaling from high resolutions

For reference, at 1080p you‰Ûªre upscaling from 720p, at 4k you‰Ûªre upscaling from 1440p",13,3/28/2023 13:10,3/28/2023 13:14,FALSE,What are your thoughts on value for money on current gen cards (RTX 40/RX 7000) for RT gaming? Which is better?,t1_je0zefi,,je22glw,u/Beastly-one,"You are pushing hard for RT, meaning you prioritize visuals. Yet, you are playing 1080p with dlss, meaning you don't actually know what stunning visuals look like. Give me 4k OLED running native resolution over 1080, regardless of which visual enhancements you stack on top of it.",8,3/28/2023 17:06,FALSE,FALSE,What are your thoughts on value for money on current gen cards (RTX 40/RX 7000) for RT gaming? Which is better?,t1_je0zefi,,je2ksgl,u/scylk2,"So you're playing 1080p and want to upgrade your 3080?  
Stop being an idiot and upgrade your monitor first.",1,3/28/2023 19:13,FALSE,FALSE,What are your thoughts on value for money on current gen cards (RTX 40/RX 7000) for RT gaming? Which is better?,t1_je0zefi,,jepdedb,u/Worldly_Pound_7625,You can still see some pop-in on objects with no collision (the leaf piles for example) or dynamic objects such as the big signs on buildings in Mega City. But that is much harder to notice than when everything has pop-in.,1,4/2/2023 16:44,FALSE,TRUE,What are your thoughts on value for money on current gen cards (RTX 40/RX 7000) for RT gaming? Which is better?,t1_jepcx75,,jepd0gm,u/Suspicious_Maybe2045,100%,1,4/2/2023 16:41,FALSE,FALSE,What are your thoughts on value for money on current gen cards (RTX 40/RX 7000) for RT gaming? Which is better?,t1_jepcx75,,je2x3cm,[deleted],[deleted],1,3/28/2023 20:43,FALSE,FALSE,What are your thoughts on value for money on current gen cards (RTX 40/RX 7000) for RT gaming? Which is better?,t1_je26vk8,,je4j5x7,u/hilltopper06,"The 1070 wasn‰Ûªt $400, it was $379, which was up from the $329 of the 970.   Either way, even accounting for inflation GPU prices have been skyrocketing.",3,3/29/2023 7:11,FALSE,FALSE,What are your thoughts on value for money on current gen cards (RTX 40/RX 7000) for RT gaming? Which is better?,t1_je3zw0v,,je4bz1x,u/Worldly_Pound_7625,I mainly play Bedrock because of the RT.,-1,3/29/2023 5:38,FALSE,TRUE,What are your thoughts on value for money on current gen cards (RTX 40/RX 7000) for RT gaming? Which is better?,t1_je4bxpi,,je5s3me,u/jdatopo814,It‰Ûªs more than just red stone in Java that I‰Ûªm referring too. But to each their own so that‰Ûªs valid.,1,3/29/2023 12:46,FALSE,FALSE,What are your thoughts on value for money on current gen cards (RTX 40/RX 7000) for RT gaming? Which is better?,t1_je4bxpi,,je0yl32,u/Worldly_Pound_7625,"I asked about this:

""**DLSS 3** shouldn't be taken into consideration when comparing RT performance, as it can be used outside of games too.""",-6,3/28/2023 12:59,FALSE,TRUE,What are your thoughts on value for money on current gen cards (RTX 40/RX 7000) for RT gaming? Which is better?,t1_je0xh3r,,je10ee7,u/keyboredYT,"RTX was also the proprietary technology that Control and Minecraft where built around. Jumping from RTX to DXR left a lot to be desired. 

DXR can still be biased towards a certain platform as the API itself is designed to run on traditional hardware as well as on hardware optimization engines. It largely depends on who is behind the development team, and DXR can be adapted to work on a certain platform more efficiently than another. In reality, shader cores optimization has impact that is far bigger than ray intersection calculations, that are faster due to the vector acceleration. This is what went poorly with Cyberpunk.",10,3/28/2023 13:10,FALSE,FALSE,What are your thoughts on value for money on current gen cards (RTX 40/RX 7000) for RT gaming? Which is better?,t1_je0x9l5,,je4c8fw,u/Worldly_Pound_7625,One letter more? And AMD hasn't currently released their alternative.,1,3/29/2023 5:41,FALSE,TRUE,What are your thoughts on value for money on current gen cards (RTX 40/RX 7000) for RT gaming? Which is better?,t1_je33u0u,,je2g1bc,u/Worldly_Pound_7625,That's just a more advanced version of RT which is also accelerated by RT cores.,3,3/28/2023 18:38,FALSE,TRUE,What are your thoughts on value for money on current gen cards (RTX 40/RX 7000) for RT gaming? Which is better?,t1_je2ezri,,je6b0xx,u/tonallyawkword,"Well 4080s don't seem to be selling @ 50% more $ than the 3080..

I guess maybe the 7900xtx is good value compared to the original price of a 6950xt, but AMD is taking their sweet time releasing a 3rd new Card.

I still can't help but think that a 4070 was renamed twice and priced $200 higher than I was hoping for.

Kinda glad I decided to stop waiting to get a new GPU right after watching both launch announcements.",3,3/29/2023 14:45,3/29/2023 14:50,FALSE,What are your thoughts on value for money on current gen cards (RTX 40/RX 7000) for RT gaming? Which is better?,t1_je4b2wr,,je4b969,u/Worldly_Pound_7625,"The only good thing about this gen is frame generation technologies, such as DLSS/FSR 3. But honestly I'm not expecting much from AMD in that regard considering how crappy FSR 1.0 was.",2,3/29/2023 5:27,FALSE,TRUE,What are your thoughts on value for money on current gen cards (RTX 40/RX 7000) for RT gaming? Which is better?,t1_je4b2wr,,